https://www.pharmgkb.org/labelAnnotation/PA166225142		PA166225142	"Annotation of FDA Label for tucatinib and ERBB2, HRAS, KRAS, NRAS"	FDA	On FDA Biomarker List	Testing Required					Cancer Genome		tucatinib	ERBB2; HRAS; KRAS; NRAS		10/24/2023
https://www.pharmgkb.org/labelAnnotation/PA166190701		PA166190701	"Annotation of FDA Label for givosiran and CPOX, HMBS, PPOX"	FDA	On FDA Biomarker List								givosiran	CPOX; HMBS; PPOX		8/17/2023
https://www.pharmgkb.org/labelAnnotation/PA166224202		PA166224202	Annotation of FDA Label for capmatinib and MET	FDA	On FDA Biomarker List	Testing Required					Cancer Genome		capmatinib	MET		8/31/2023
https://www.pharmgkb.org/labelAnnotation/PA166191501		PA166191501	Annotation of FDA Label for lenvatinib	FDA	On FDA Biomarker List	Testing Required					Cancer Genome		lenvatinib			8/31/2023
https://www.pharmgkb.org/labelAnnotation/PA166236521		PA166236521	Annotation of FDA Label for viltolarsen and DMD	FDA	On FDA Biomarker List	Testing Required							viltolarsen	DMD		8/21/2023
https://www.pharmgkb.org/labelAnnotation/PA166236001		PA166236001	Annotation of FDA Label for sodium oxybate and ALDH5A1	FDA	On FDA Biomarker List	Actionable PGx	Prescribing Info		Alternate Drug			Prescribing	sodium oxybate	ALDH5A1		4/22/2022
https://www.pharmgkb.org/labelAnnotation/PA166121327		PA166121327	Annotation of EMA Label for pegloticase and G6PD	EMA		Testing Required	Prescribing Info		Alternate Drug			Prescribing	pegloticase	G6PD		3/31/2023
https://www.pharmgkb.org/labelAnnotation/PA166278321		PA166278321	Annotation of FDA Label for ganaxolone and CDKL5	FDA	On FDA Biomarker List	Testing Required							ganaxolone	CDKL5		8/21/2023
https://www.pharmgkb.org/labelAnnotation/PA166169884		PA166169884	"Annotation of FDA Label for durvalumab and ALK, CD274, EGFR, PDCD1"	FDA	On FDA Biomarker List	Testing Required					Cancer Genome		durvalumab	ALK; CD274; EGFR; PDCD1		8/31/2023
https://www.pharmgkb.org/labelAnnotation/PA166191581		PA166191581	"Annotation of FDA Label for ipilimumab and ALK, CD274, EGFR"	FDA	On FDA Biomarker List	Testing Required					Cancer Genome		ipilimumab	ALK; CD274; EGFR		12/4/2023
https://www.pharmgkb.org/labelAnnotation/PA166182719		PA166182719	Annotation of FDA Label for ipilimumab and HLA-A	FDA	On FDA Biomarker List	No Clinical PGx							ipilimumab	HLA-A	HLA-A*02:01	12/4/2023
https://www.pharmgkb.org/labelAnnotation/PA166123390		PA166123390	Annotation of EMA Label for fampridine and SLC22A2	EMA									fampridine	SLC22A2		8/17/2023
https://www.pharmgkb.org/labelAnnotation/PA166123412		PA166123412	Annotation of EMA Label for sunitinib and CYP3A4	EMA									sunitinib	CYP3A4		8/24/2023
https://www.pharmgkb.org/labelAnnotation/PA166123421		PA166123421	Annotation of EMA Label for atazanavir and CYP2C19	EMA		Informative PGx							atazanavir	CYP2C19		7/25/2024
https://www.pharmgkb.org/labelAnnotation/PA166123528		PA166123528	Annotation of PMDA Label for atomoxetine and CYP2D6	PMDA		Actionable PGx							atomoxetine	CYP2D6		
https://www.pharmgkb.org/labelAnnotation/PA166123530		PA166123530	Annotation of PMDA Label for azathioprine and TPMT	PMDA		Actionable PGx							azathioprine	TPMT		
https://www.pharmgkb.org/labelAnnotation/PA166123531		PA166123531	Annotation of PMDA Label for capecitabine and DPYD	PMDA		Actionable PGx							capecitabine	DPYD		
https://www.pharmgkb.org/labelAnnotation/PA166123535		PA166123535	Annotation of PMDA Label for clopidogrel and CYP2C19	PMDA		Actionable PGx							clopidogrel	CYP2C19		
https://www.pharmgkb.org/labelAnnotation/PA166123536		PA166123536	Annotation of PMDA Label for crizotinib and ALK	PMDA		Testing Required							crizotinib	ALK		
https://www.pharmgkb.org/labelAnnotation/PA166123538		PA166123538	Annotation of PMDA Label for eltrombopag and SERPINC1	PMDA		Actionable PGx							eltrombopag	SERPINC1		
https://www.pharmgkb.org/labelAnnotation/PA166123539		PA166123539	Annotation of PMDA Label for fluorouracil and DPYD	PMDA		Actionable PGx							fluorouracil	DPYD		
https://www.pharmgkb.org/labelAnnotation/PA166123543		PA166123543	Annotation of PMDA Label for indacaterol and UGT1A1	PMDA		Actionable PGx							indacaterol	UGT1A1		
https://www.pharmgkb.org/labelAnnotation/PA166123526		PA166123526	Annotation of PMDA Label for irinotecan and UGT1A1	PMDA		Testing Recommended							irinotecan	UGT1A1		
https://www.pharmgkb.org/labelAnnotation/PA166123546		PA166123546	Annotation of PMDA Label for mycophenolic acid and HPRT1	PMDA		Actionable PGx							mycophenolic acid	HPRT1		
https://www.pharmgkb.org/labelAnnotation/PA166123547		PA166123547	Annotation of PMDA Label for panitumumab and KRAS	PMDA		Testing Required							panitumumab	KRAS		
https://www.pharmgkb.org/labelAnnotation/PA166123548		PA166123548	Annotation of PMDA Label for rasburicase and G6PD	PMDA		Actionable PGx							rasburicase	G6PD		
https://www.pharmgkb.org/labelAnnotation/PA166123550		PA166123550	Annotation of PMDA Label for trastuzumab and ERBB2	PMDA		Testing Required							trastuzumab	ERBB2		
https://www.pharmgkb.org/labelAnnotation/PA166123537		PA166123537	"Annotation of PMDA Label for dasatinib and ABL1, BCR"	PMDA		Testing Required							dasatinib	ABL1; BCR		
https://www.pharmgkb.org/labelAnnotation/PA166127722		PA166127722	Annotation of HCSC Label for trametinib and BRAF	HCSC		Testing Required					Cancer Genome		trametinib	BRAF		4/21/2024
https://www.pharmgkb.org/labelAnnotation/PA166127724		PA166127724	Annotation of HCSC Label for trastuzumab and ERBB2	HCSC		Testing Required					Cancer Genome		trastuzumab	ERBB2		4/21/2024
https://www.pharmgkb.org/labelAnnotation/PA166127721		PA166127721	Annotation of HCSC Label for tolterodine and CYP2D6	HCSC		Informative PGx							tolterodine	CYP2D6		7/26/2024
https://www.pharmgkb.org/labelAnnotation/PA166127725		PA166127725	"Annotation of HCSC Label for tretinoin and PML, RARA"	HCSC							Cancer Genome		tretinoin	PML; RARA		8/6/2024
https://www.pharmgkb.org/labelAnnotation/PA166123408		PA166123408	Annotation of EMA Label for vortioxetine and CYP2D6	EMA		Actionable PGx	Prescribing Info	Dosing Info				Prescribing	vortioxetine	CYP2D6		9/15/2014
https://www.pharmgkb.org/labelAnnotation/PA166127723		PA166127723	Annotation of HCSC Label for trastuzumab emtansine and ERBB2	HCSC		Testing Required					Cancer Genome		trastuzumab emtansine	ERBB2		4/21/2024
https://www.pharmgkb.org/labelAnnotation/PA166127731		PA166127731	Annotation of HCSC Label for vortioxetine and CYP2D6	HCSC		Informative PGx							vortioxetine	CYP2D6		
https://www.pharmgkb.org/labelAnnotation/PA166127728		PA166127728	Annotation of HCSC Label for vemurafenib and BRAF	HCSC		Testing Required					Cancer Genome		vemurafenib	BRAF		4/21/2024
https://www.pharmgkb.org/labelAnnotation/PA166127727		PA166127727	Annotation of HCSC Label for velaglucerase alfa and GBA	HCSC									velaglucerase alfa	GBA		8/6/2024
https://www.pharmgkb.org/labelAnnotation/PA166127732		PA166127732	"Annotation of HCSC Label for warfarin and CYP2C9, VKORC1"	HCSC		Informative PGx							warfarin	CYP2C9; VKORC1		
https://www.pharmgkb.org/labelAnnotation/PA166127730		PA166127730	Annotation of HCSC Label for voriconazole and CYP2C19	HCSC		Informative PGx							voriconazole	CYP2C19		
https://www.pharmgkb.org/labelAnnotation/PA166127729		PA166127729	Annotation of HCSC Label for moviprep and G6PD	HCSC		Informative PGx							moviprep	G6PD		7/25/2024
https://www.pharmgkb.org/labelAnnotation/PA166129516		PA166129516	"Annotation of HCSC Label for desflurane and CACNA1S, RYR1"	HCSC		Actionable PGx	Prescribing Info		Alternate Drug			Prescribing	desflurane	CACNA1S; RYR1		3/31/2023
https://www.pharmgkb.org/labelAnnotation/PA166129515		PA166129515	"Annotation of FDA Label for desflurane and CACNA1S, RYR1"	FDA	On FDA Biomarker List	Actionable PGx	Prescribing Info		Alternate Drug			Prescribing	desflurane	CACNA1S; RYR1		3/31/2023
https://www.pharmgkb.org/labelAnnotation/PA166129449		PA166129449	Annotation of EMA Label for ceritinib and ALK	EMA		Testing Required					Cancer Genome		ceritinib	ALK		4/16/2024
https://www.pharmgkb.org/labelAnnotation/PA166129448		PA166129448	Annotation of EMA Label for ibrutinib	EMA							Cancer Genome		ibrutinib			8/7/2024
https://www.pharmgkb.org/labelAnnotation/PA166123422		PA166123422	Annotation of EMA Label for efavirenz / emtricitabine / tenofovir disoproxil and CYP2B6	EMA		Informative PGx							efavirenz / emtricitabine / tenofovir disoproxil	CYP2B6	CYP2B6*6; rs3745274	9/16/2014
https://www.pharmgkb.org/labelAnnotation/PA166127665		PA166127665	Annotation of HCSC Label for divalproex sodium and POLG	HCSC		Testing Required							divalproex sodium	POLG		
https://www.pharmgkb.org/labelAnnotation/PA166129518		PA166129518	"Annotation of HCSC Label for isoflurane and CACNA1S, RYR1"	HCSC		Actionable PGx	Prescribing Info		Alternate Drug			Prescribing	isoflurane	CACNA1S; RYR1		4/1/2023
https://www.pharmgkb.org/labelAnnotation/PA166127681		PA166127681	Annotation of HCSC Label for ibrutinib	HCSC							Cancer Genome		ibrutinib			8/7/2024
https://www.pharmgkb.org/labelAnnotation/PA166123409		PA166123409	Annotation of EMA Label for aliskiren and ABCB1	EMA									aliskiren	ABCB1		8/14/2023
https://www.pharmgkb.org/labelAnnotation/PA166123418		PA166123418	Annotation of EMA Label for posaconazole and CYP3A4	EMA									posaconazole	CYP3A4		8/23/2023
https://www.pharmgkb.org/labelAnnotation/PA166123419		PA166123419	Annotation of EMA Label for indinavir and CYP3A4	EMA									indinavir	CYP3A4		8/18/2023
https://www.pharmgkb.org/labelAnnotation/PA166127630		PA166127630	"Annotation of HCSC Label for anastrozole and ESR1, ESR2, PGR"	HCSC							Cancer Genome		anastrozole	ESR1; ESR2; PGR		8/26/2024
https://www.pharmgkb.org/labelAnnotation/PA166127675		PA166127675	Annotation of HCSC Label for galantamine and CYP2D6	HCSC		No Clinical PGx							galantamine	CYP2D6		8/17/2023
https://www.pharmgkb.org/labelAnnotation/PA166127655		PA166127655	Annotation of HCSC Label for crizotinib and ALK	HCSC		Testing Required					Cancer Genome		crizotinib	ALK		4/16/2024
https://www.pharmgkb.org/labelAnnotation/PA166127673		PA166127673	Annotation of HCSC Label for fesoterodine and CYP2D6	HCSC		Informative PGx							fesoterodine	CYP2D6		
https://www.pharmgkb.org/labelAnnotation/PA166127669		PA166127669	Annotation of HCSC Label for erlotinib and EGFR	HCSC		Testing Required					Cancer Genome		erlotinib	EGFR		4/16/2024
https://www.pharmgkb.org/labelAnnotation/PA166127674		PA166127674	Annotation of HCSC Label for fluorouracil and DPYD	HCSC		Testing Recommended	Prescribing Info		Alternate Drug			Prescribing	fluorouracil	DPYD		4/25/2024
https://www.pharmgkb.org/labelAnnotation/PA166127628		PA166127628	"Annotation of HCSC Label for acetaminophen, tramadol and CYP2D6"	HCSC		Informative PGx							acetaminophen; tramadol	CYP2D6		7/18/2024
https://www.pharmgkb.org/labelAnnotation/PA166127627		PA166127627	Annotation of HCSC Label for abacavir and HLA-B	HCSC		Testing Required	Prescribing Info		Alternate Drug			Prescribing	abacavir	HLA-B	HLA-B*57:01	2/7/2024
https://www.pharmgkb.org/labelAnnotation/PA166127631		PA166127631	Annotation of HCSC Label for aripiprazole and CYP2D6	HCSC		Informative PGx							aripiprazole	CYP2D6		
https://www.pharmgkb.org/labelAnnotation/PA166127629		PA166127629	Annotation of HCSC Label for afatinib and EGFR	HCSC		Testing Required					Cancer Genome		afatinib	EGFR	rs121434568	5/10/2024
https://www.pharmgkb.org/labelAnnotation/PA166127656		PA166127656	Annotation of HCSC Label for dabrafenib and BRAF	HCSC		Testing Required					Cancer Genome		dabrafenib	BRAF		5/14/2024
https://www.pharmgkb.org/labelAnnotation/PA166127653		PA166127653	Annotation of HCSC Label for clopidogrel and CYP2C19	HCSC		Actionable PGx	Prescribing Info		Alternate Drug			Prescribing	clopidogrel	CYP2C19	CYP2C19*2; CYP2C19*3; CYP2C19*4; CYP2C19*5; CYP2C19*6; CYP2C19*7; CYP2C19*8	7/17/2024
https://www.pharmgkb.org/labelAnnotation/PA166127654		PA166127654	Annotation of HCSC Label for codeine and CYP2D6	HCSC		Actionable PGx	Prescribing Info		Alternate Drug			Prescribing	codeine	CYP2D6	CYP2D6*2x2	7/19/2024
https://www.pharmgkb.org/labelAnnotation/PA166127677		PA166127677	Annotation of HCSC Label for glyburide and G6PD	HCSC		Actionable PGx	Prescribing Info		Alternate Drug	Other Prescribing Guidance		Prescribing	glyburide	G6PD		7/22/2024
https://www.pharmgkb.org/labelAnnotation/PA166127678		PA166127678	Annotation of HCSC Label for glimepiride and G6PD	HCSC		Actionable PGx	Prescribing Info		Alternate Drug	Other Prescribing Guidance		Prescribing	glimepiride	G6PD		7/22/2024
https://www.pharmgkb.org/labelAnnotation/PA166127676		PA166127676	Annotation of HCSC Label for gefitinib and EGFR	HCSC		Testing Required					Cancer Genome		gefitinib	EGFR		8/7/2024
https://www.pharmgkb.org/labelAnnotation/PA166127670		PA166127670	Annotation of HCSC Label for esomeprazole and CYP2C19	HCSC		No Clinical PGx							esomeprazole	CYP2C19		7/26/2024
https://www.pharmgkb.org/labelAnnotation/PA166127667		PA166127667	Annotation of HCSC Label for efavirenz / emtricitabine / tenofovir disoproxil and CYP2B6	HCSC		Informative PGx							efavirenz / emtricitabine / tenofovir disoproxil	CYP2B6		
https://www.pharmgkb.org/labelAnnotation/PA166127661		PA166127661	Annotation of HCSC Label for dexlansoprazole and CYP2C19	HCSC		Informative PGx							dexlansoprazole	CYP2C19		
https://www.pharmgkb.org/labelAnnotation/PA166127659		PA166127659	Annotation of HCSC Label for darifenacin and CYP2D6	HCSC		Informative PGx							darifenacin	CYP2D6		
https://www.pharmgkb.org/labelAnnotation/PA166127657		PA166127657	Annotation of HCSC Label for dapsone and G6PD	HCSC		No Clinical PGx							dapsone	G6PD		7/19/2024
https://www.pharmgkb.org/labelAnnotation/PA166123416		PA166123416	Annotation of EMA Label for ivabradine and CYP3A4	EMA									ivabradine	CYP3A4		8/18/2023
https://www.pharmgkb.org/labelAnnotation/PA166129447		PA166129447	Annotation of EMA Label for eliglustat and CYP2D6	EMA		Testing Required	Prescribing Info	Dosing Info	Alternate Drug			Prescribing	eliglustat	CYP2D6		
https://www.pharmgkb.org/labelAnnotation/PA166127714		PA166127714	Annotation of HCSC Label for sulfadiazine and G6PD	HCSC		Actionable PGx	Prescribing Info			Other Prescribing Guidance		Prescribing	sulfadiazine	G6PD		7/21/2024
https://www.pharmgkb.org/labelAnnotation/PA166127688		PA166127688	Annotation of HCSC Label for lomitapide and LDLR	HCSC									lomitapide	LDLR		12/19/2023
https://www.pharmgkb.org/labelAnnotation/PA166127686		PA166127686	Annotation of HCSC Label for lenalidomide	HCSC		Testing Required					Cancer Genome		lenalidomide			5/2/2024
https://www.pharmgkb.org/labelAnnotation/PA166127684		PA166127684	Annotation of HCSC Label for ivacaftor and CFTR	HCSC		Testing Required							ivacaftor	CFTR	rs113993960; rs121908755; rs121908757; rs121909005; rs121909013; rs121909041; rs193922525; rs267606723; rs397508453; rs74503330; rs75527207; rs80282562	4/21/2024
https://www.pharmgkb.org/labelAnnotation/PA166127683		PA166127683	Annotation of HCSC Label for irinotecan and UGT1A1	HCSC		Testing Recommended	Prescribing Info	Dosing Info				Prescribing	irinotecan	UGT1A1	UGT1A1*28; UGT1A1*6	5/30/2024
https://www.pharmgkb.org/labelAnnotation/PA166127696		PA166127696	Annotation of HCSC Label for norfloxacin and G6PD	HCSC		Informative PGx							norfloxacin	G6PD		7/23/2024
https://www.pharmgkb.org/labelAnnotation/PA166127698		PA166127698	Annotation of HCSC Label for omeprazole and CYP2C19	HCSC		No Clinical PGx							omeprazole	CYP2C19		
https://www.pharmgkb.org/labelAnnotation/PA166127694		PA166127694	Annotation of HCSC Label for nitrofurantoin and G6PD	HCSC		Actionable PGx	Prescribing Info		Alternate Drug			Prescribing	nitrofurantoin	G6PD		7/23/2024
https://www.pharmgkb.org/labelAnnotation/PA166127715		PA166127715	Annotation of HCSC Label for sulfamethoxazole / trimethoprim and G6PD	HCSC		Informative PGx							sulfamethoxazole / trimethoprim	G6PD		7/22/2024
https://www.pharmgkb.org/labelAnnotation/PA166127690		PA166127690	"Annotation of HCSC Label for mercaptopurine and NUDT15, TPMT"	HCSC		Testing Recommended	Prescribing Info	Dosing Info				Prescribing	mercaptopurine	NUDT15; TPMT	rs116855232; TPMT*2; TPMT*3A; TPMT*3C	7/25/2024
https://www.pharmgkb.org/labelAnnotation/PA166127692		PA166127692	Annotation of HCSC Label for mycophenolic acid and HPRT1	HCSC		Actionable PGx	Prescribing Info		Alternate Drug			Prescribing	mycophenolic acid	HPRT1		7/25/2024
https://www.pharmgkb.org/labelAnnotation/PA166127718		PA166127718	"Annotation of HCSC Label for tamoxifen and ESR1, ESR2, PGR"	HCSC		Testing Required					Cancer Genome		tamoxifen	ESR1; ESR2; PGR		8/14/2024
https://www.pharmgkb.org/labelAnnotation/PA166127716		PA166127716	Annotation of HCSC Label for sulfasalazine and G6PD	HCSC		Actionable PGx	Prescribing Info			Other Prescribing Guidance		Prescribing	sulfasalazine	G6PD		8/14/2024
https://www.pharmgkb.org/labelAnnotation/PA166127697		PA166127697	Annotation of HCSC Label for nortriptyline and CYP2D6	HCSC		Informative PGx							nortriptyline	CYP2D6		7/24/2024
https://www.pharmgkb.org/labelAnnotation/PA166123423		PA166123423	Annotation of EMA Label for tipranavir and CYP3A4	EMA									tipranavir	CYP3A4		8/27/2023
https://www.pharmgkb.org/labelAnnotation/PA166129450		PA166129450	Annotation of EMA Label for trametinib and BRAF	EMA		Testing Required					Cancer Genome		trametinib	BRAF		4/21/2024
https://www.pharmgkb.org/labelAnnotation/PA166129520		PA166129520	"Annotation of HCSC Label for sevoflurane and CACNA1S, RYR1"	HCSC		Actionable PGx	Prescribing Info		Alternate Drug			Prescribing	sevoflurane	CACNA1S; RYR1		4/1/2023
https://www.pharmgkb.org/labelAnnotation/PA166182753		PA166182753	Annotation of FDA Label for meloxicam and CYP2C9	FDA	On FDA Biomarker List	Actionable PGx	Prescribing Info	Dosing Info		Other Prescribing Guidance		Prescribing	meloxicam	CYP2C9	CYP2C9*3	8/24/2023
https://www.pharmgkb.org/labelAnnotation/PA166127719		PA166127719	Annotation of HCSC Label for tetrabenazine and CYP2D6	HCSC		Actionable PGx	Prescribing Info			Other Prescribing Guidance		Prescribing	tetrabenazine	CYP2D6		7/18/2024
https://www.pharmgkb.org/labelAnnotation/PA166127720		PA166127720	"Annotation of HCSC Label for thioguanine and NUDT15, TPMT"	HCSC		Testing Recommended	Prescribing Info	Dosing Info		Other Prescribing Guidance		Prescribing	thioguanine	NUDT15; TPMT	rs116855232; TPMT*2; TPMT*3A; TPMT*3B; TPMT*3C; TPMT*4	7/19/2024
https://www.pharmgkb.org/labelAnnotation/PA166190201		PA166190201	"Annotation of FDA Label for entrectinib and NTRK1, NTRK2, NTRK3, ROS1"	FDA	On FDA Biomarker List	Testing Required					Cancer Genome		entrectinib	NTRK1; NTRK2; NTRK3; ROS1		4/16/2024
https://www.pharmgkb.org/labelAnnotation/PA166189821		PA166189821	Annotation of FDA Label for voxelotor and HBB	FDA	On FDA Biomarker List								voxelotor	HBB		3/31/2024
https://www.pharmgkb.org/labelAnnotation/PA166190741		PA166190741	Annotation of FDA Label for golodirsen and DMD	FDA	On FDA Biomarker List	Testing Required							golodirsen	DMD		8/21/2023
https://www.pharmgkb.org/labelAnnotation/PA166189982		PA166189982	Annotation of FDA Label for crizanlizumab-tmca and HBB	FDA	On FDA Biomarker List								crizanlizumab-tmca	HBB		3/31/2024
https://www.pharmgkb.org/labelAnnotation/PA166124617		PA166124617	Annotation of FDA Label for ceritinib and ALK	FDA	On FDA Biomarker List	Testing Required					Cancer Genome		ceritinib	ALK		9/1/2023
https://www.pharmgkb.org/labelAnnotation/PA166115367		PA166115367	Annotation of FDA Label for velaglucerase alfa and GBA	FDA	Formerly on FDA Biomarker List								velaglucerase alfa	GBA		8/6/2024
https://www.pharmgkb.org/labelAnnotation/PA166114910		PA166114910	Annotation of FDA Label for chlorpropamide and G6PD	FDA	On FDA Biomarker List	Actionable PGx	Prescribing Info		Alternate Drug	Other Prescribing Guidance		Prescribing	chlorpropamide	G6PD		8/25/2023
https://www.pharmgkb.org/labelAnnotation/PA166104787		PA166104787	Annotation of FDA Label for cevimeline and CYP2D6	FDA	On FDA Biomarker List	Actionable PGx	Prescribing Info			Other Prescribing Guidance		Prescribing	cevimeline	CYP2D6		10/25/2013
https://www.pharmgkb.org/labelAnnotation/PA166184423		PA166184423	Annotation of Swissmedic Label for antithrombotic agents and G6PD	Swissmedic		Actionable PGx							antithrombotic agents	G6PD		
https://www.pharmgkb.org/labelAnnotation/PA166184111		PA166184111	Annotation of Swissmedic Label for atomoxetine and CYP2D6	Swissmedic		Actionable PGx							atomoxetine	CYP2D6		
https://www.pharmgkb.org/labelAnnotation/PA166184456		PA166184456	Annotation of Swissmedic Label for glyburide and G6PD	Swissmedic		Actionable PGx							glyburide	G6PD		
https://www.pharmgkb.org/labelAnnotation/PA166184223		PA166184223	"Annotation of Swissmedic Label for Paracetamol, combinations excl. Psycholeptics (Vicks MediNait Sirup) and CYP2D6, G6PD"	Swissmedic		Actionable PGx	Prescribing Info					Prescribing	"Paracetamol, combinations excl. Psycholeptics (Vicks MediNait Sirup)"	CYP2D6; G6PD		2/28/2023
https://www.pharmgkb.org/labelAnnotation/PA166184428		PA166184428	Annotation of Swissmedic Label for sertindole and CYP2D6	Swissmedic		Actionable PGx							sertindole	CYP2D6		
https://www.pharmgkb.org/labelAnnotation/PA166184231		PA166184231	Annotation of Swissmedic Label for umeclidinium and CYP2D6	Swissmedic		Informative PGx							umeclidinium	CYP2D6		
https://www.pharmgkb.org/labelAnnotation/PA166184237		PA166184237	Annotation of Swissmedic Label for Vitamin B-complex with vitamin C and G6PD	Swissmedic		Actionable PGx							Vitamin B-complex with vitamin C	G6PD		
https://www.pharmgkb.org/labelAnnotation/PA166184490		PA166184490	Annotation of Swissmedic Label for zuclopenthixol and CYP2D6	Swissmedic									zuclopenthixol	CYP2D6		8/29/2023
https://www.pharmgkb.org/labelAnnotation/PA166184499		PA166184499	"Annotation of Swissmedic Label for rosuvastatin and ABCG2, SLCO1B1"	Swissmedic		Actionable PGx	Prescribing Info	Dosing Info				Prescribing	rosuvastatin	ABCG2; SLCO1B1	rs2231142; rs4149056	8/13/2024
https://www.pharmgkb.org/labelAnnotation/PA166184434		PA166184434	"Annotation of Swissmedic Label for sofosbuvir and IFNL3, IFNL4"	Swissmedic		Actionable PGx	Prescribing Info					Prescribing	sofosbuvir	IFNL3; IFNL4	rs12979860	
https://www.pharmgkb.org/labelAnnotation/PA166223861		PA166223861	Annotation of FDA Label for bupropion and CYP2D6	FDA	On FDA Biomarker List								bupropion	CYP2D6		8/14/2023
https://www.pharmgkb.org/labelAnnotation/PA166223902		PA166223902	Annotation of FDA Label for alglucosidase alfa and GAA	FDA	On FDA Biomarker List	Testing Required							alglucosidase alfa	GAA		8/21/2023
https://www.pharmgkb.org/labelAnnotation/PA166223941		PA166223941	Annotation of FDA Label for avapritinib and PDGFRA	FDA	On FDA Biomarker List	Testing Required					Cancer Genome		avapritinib	PDGFRA	rs121908585	8/31/2023
https://www.pharmgkb.org/labelAnnotation/PA166224061		PA166224061	Annotation of HCSC Label for oxcarbazepine and HLA-B	HCSC		Testing Recommended	Prescribing Info		Alternate Drug			Prescribing	oxcarbazepine	HLA-B	HLA-B*15:02	7/26/2024
https://www.pharmgkb.org/labelAnnotation/PA166127664		PA166127664	Annotation of FDA Label for ibrutinib	FDA	On FDA Biomarker List						Cancer Genome		ibrutinib			8/7/2024
https://www.pharmgkb.org/labelAnnotation/PA166224361		PA166224361	Annotation of FDA Label for gemtuzumab ozogamicin and CD33	FDA	On FDA Biomarker List	Testing Required					Cancer Genome		gemtuzumab ozogamicin	CD33		8/31/2023
https://www.pharmgkb.org/labelAnnotation/PA166224101		PA166224101	Annotation of FDA Label for citalopram and CYP2D6	FDA	On FDA Biomarker List	No Clinical PGx							citalopram	CYP2D6		8/15/2023
https://www.pharmgkb.org/labelAnnotation/PA166224962		PA166224962	Annotation of FDA Label for isatuximab	FDA	On FDA Biomarker List						Cancer Genome		isatuximab			8/18/2023
https://www.pharmgkb.org/labelAnnotation/PA166224961		PA166224961	Annotation of FDA Label for inebilizumab and AQP4	FDA	On FDA Biomarker List								inebilizumab	AQP4		9/28/2023
https://www.pharmgkb.org/labelAnnotation/PA166224121		PA166224121	Annotation of FDA Label for escitalopram and CYP2D6	FDA	On FDA Biomarker List								escitalopram	CYP2D6		10/24/2023
https://www.pharmgkb.org/labelAnnotation/PA166224441		PA166224441	Annotation of FDA Label for ibrutinib and MYD88	FDA	On FDA Biomarker List						Cancer Genome		ibrutinib	MYD88	rs387907272	8/18/2023
https://www.pharmgkb.org/labelAnnotation/PA166224221		PA166224221	"Annotation of FDA Label for eculizumab and AQP4, CHRNA1, CHRNA3, CHRNA4, CHRNA5, CHRNA6, CHRNA7, CHRNB1, CHRNE"	FDA	On FDA Biomarker List								eculizumab	AQP4; CHRNA1; CHRNA3; CHRNA4; CHRNA5; CHRNA6; CHRNA7; CHRNB1; CHRNE		9/28/2023
https://www.pharmgkb.org/labelAnnotation/PA166225161		PA166225161	Annotation of FDA Label for oliceridine and CYP2D6	FDA		Actionable PGx	Prescribing Info	Dosing Info		Other Prescribing Guidance		Prescribing	oliceridine	CYP2D6		9/25/2023
https://www.pharmgkb.org/labelAnnotation/PA166185145		PA166185145	Annotation of FDA Label for brentuximab vedotin and TNFRSF8	FDA	On FDA Biomarker List						Cancer Genome		brentuximab vedotin	TNFRSF8		8/5/2024
https://www.pharmgkb.org/labelAnnotation/PA166227321		PA166227321	Annotation of HCSC Label for amifampridine phosphate and NAT2	HCSC		Actionable PGx	Prescribing Info	Dosing Info				Prescribing	amifampridine phosphate	NAT2		
https://www.pharmgkb.org/labelAnnotation/PA166227161		PA166227161	Annotation of EMA Label for ramucirumab and KRAS	EMA							Cancer Genome		ramucirumab	KRAS		8/23/2023
https://www.pharmgkb.org/labelAnnotation/PA166227221		PA166227221	Annotation of EMA Label for amifampridine phosphate and NAT2	EMA		Informative PGx							amifampridine phosphate	NAT2		
https://www.pharmgkb.org/labelAnnotation/PA166160054		PA166160054	Annotation of FDA Label for brexpiprazole and CYP2D6	FDA	On FDA Biomarker List	Actionable PGx	Prescribing Info	Dosing Info				Prescribing	brexpiprazole	CYP2D6		5/1/2019
