https://www.pharmgkb.org/labelAnnotation/PA166183219		PA166183219	Annotation of EMA Label for mirabegron and CYP2D6	EMA		No Clinical PGx							mirabegron	CYP2D6		8/15/2023
https://www.pharmgkb.org/labelAnnotation/PA166183563		PA166183563	Annotation of Swissmedic Label for abacavir and HLA-B	Swissmedic		Testing Required	Prescribing Info		Alternate Drug			Prescribing	abacavir	HLA-B	HLA-B*57:01	2/28/2023
https://www.pharmgkb.org/labelAnnotation/PA166161536		PA166161536	Annotation of PMDA Label for atazanavir and CYP2C19	PMDA		Actionable PGx							atazanavir	CYP2C19		
https://www.pharmgkb.org/labelAnnotation/PA166182766		PA166182766	"Annotation of FDA Label for fosphenytoin and CYP2C19, CYP2C9, HLA-B"	FDA	On FDA Biomarker List	Actionable PGx	Prescribing Info	Dosing Info	Alternate Drug			Prescribing	fosphenytoin	CYP2C19; CYP2C9; HLA-B	CYP2C9*2; CYP2C9*3; HLA-B*15:02	8/23/2023
https://www.pharmgkb.org/labelAnnotation/PA166183441		PA166183441	Annotation of EMA Label for umeclidinium and CYP2D6	EMA		No Clinical PGx							umeclidinium	CYP2D6		
https://www.pharmgkb.org/labelAnnotation/PA166182928		PA166182928	Annotation of EMA Label for binimetinib and BRAF	EMA		Testing Required					Cancer Genome		binimetinib	BRAF	rs113488022	4/16/2024
https://www.pharmgkb.org/labelAnnotation/PA166177479		PA166177479	Annotation of FDA Label for cariprazine and CYP2D6	FDA	On FDA Biomarker List	No Clinical PGx							cariprazine	CYP2D6		8/15/2023
https://www.pharmgkb.org/labelAnnotation/PA166182942		PA166182942	Annotation of EMA Label for dacomitinib and EGFR	EMA		Testing Required					Cancer Genome		dacomitinib	EGFR		4/16/2024
https://www.pharmgkb.org/labelAnnotation/PA166182953		PA166182953	Annotation of EMA Label for ivacaftor / lumacaftor and CFTR	EMA		Testing Required							ivacaftor / lumacaftor	CFTR	rs113993960	4/21/2024
https://www.pharmgkb.org/labelAnnotation/PA166183423		PA166183423	"Annotation of EMA Label for rucaparib and BRCA1, BRCA2"	EMA		Testing Required					Cancer Genome		rucaparib	BRCA1; BRCA2		4/21/2024
https://www.pharmgkb.org/labelAnnotation/PA166182934		PA166182934	Annotation of EMA Label for cerliponase alfa and TPP1	EMA									cerliponase alfa	TPP1		8/5/2024
https://www.pharmgkb.org/labelAnnotation/PA166182932		PA166182932	Annotation of EMA Label for brivaracetam and CYP2C19	EMA		Informative PGx							brivaracetam	CYP2C19		7/15/2024
https://www.pharmgkb.org/labelAnnotation/PA166170937		PA166170937	Annotation of FDA Label for trametinib and G6PD	FDA	On FDA Biomarker List								trametinib	G6PD		8/29/2023
https://www.pharmgkb.org/labelAnnotation/PA166184917		PA166184917	Annotation of FDA Label for avatrombopag and CYP2C9	FDA	On FDA Biomarker List	Informative PGx							avatrombopag	CYP2C9	CYP2C9*2; CYP2C9*3	7/11/2024
https://www.pharmgkb.org/labelAnnotation/PA166160668		PA166160668	Annotation of PMDA Label for allopurinol and HLA-B	PMDA		Informative PGx							allopurinol	HLA-B	HLA-B*58:01	
https://www.pharmgkb.org/labelAnnotation/PA166183200		PA166183200	Annotation of EMA Label for midostaurin and FLT3	EMA		Testing Required					Cancer Genome		midostaurin	FLT3		4/21/2024
https://www.pharmgkb.org/labelAnnotation/PA166183184		PA166183184	Annotation of EMA Label for lorlatinib and ALK	EMA		Testing Required					Cancer Genome		lorlatinib	ALK		5/24/2024
https://www.pharmgkb.org/labelAnnotation/PA166177516		PA166177516	Annotation of FDA Label for neratinib and ERBB2	FDA	On FDA Biomarker List	Testing Required					Cancer Genome		neratinib	ERBB2		8/31/2023
https://www.pharmgkb.org/labelAnnotation/PA166159586		PA166159586	Annotation of HCSC Label for aliskiren and ABCB1	HCSC									aliskiren	ABCB1		8/14/2023
https://www.pharmgkb.org/labelAnnotation/PA166183784		PA166183784	Annotation of Swissmedic Label for amifampridine phosphate and NAT2	Swissmedic		Actionable PGx							amifampridine phosphate	NAT2		
https://www.pharmgkb.org/labelAnnotation/PA166183782		PA166183782	Annotation of Swissmedic Label for aspirin and G6PD	Swissmedic		Actionable PGx							aspirin	G6PD		
https://www.pharmgkb.org/labelAnnotation/PA166184232		PA166184232	Annotation of Swissmedic Label for venlafaxine and CYP2D6	Swissmedic		Actionable PGx							venlafaxine	CYP2D6		
https://www.pharmgkb.org/labelAnnotation/PA166159584		PA166159584	Annotation of HCSC Label for afutuzumab and MS4A1	HCSC							Cancer Genome		afutuzumab	MS4A1		8/11/2023
https://www.pharmgkb.org/labelAnnotation/PA166183249		PA166183249	"Annotation of EMA Label for pembrolizumab and ALK, CD274, EGFR, ERBB2"	EMA		Testing Required					Cancer Genome		pembrolizumab	ALK; CD274; EGFR; ERBB2		4/21/2024
https://www.pharmgkb.org/labelAnnotation/PA166170930		PA166170930	"Annotation of FDA Label for dabrafenib and HRAS, KRAS, NRAS"	FDA	On FDA Biomarker List	Actionable PGx	Prescribing Info		Alternate Drug	Other Prescribing Guidance	Cancer Genome	Prescribing	dabrafenib	HRAS; KRAS; NRAS		11/30/2023
https://www.pharmgkb.org/labelAnnotation/PA166183251		PA166183251	Annotation of EMA Label for raltegravir and UGT1A1	EMA		No Clinical PGx							raltegravir	UGT1A1		8/23/2023
https://www.pharmgkb.org/labelAnnotation/PA166183248		PA166183248	Annotation of EMA Label for palonosetron and CYP2D6	EMA		No Clinical PGx							palonosetron	CYP2D6		
https://www.pharmgkb.org/labelAnnotation/PA166169877		PA166169877	Annotation of FDA Label for avelumab and CD274	FDA	On FDA Biomarker List						Cancer Genome		avelumab	CD274		8/5/2024
https://www.pharmgkb.org/labelAnnotation/PA166183783		PA166183783	Annotation of Swissmedic Label for allopurinol and HLA-B	Swissmedic		Actionable PGx	Prescribing Info					Prescribing	allopurinol	HLA-B	HLA-B*58:01	2/28/2023
https://www.pharmgkb.org/labelAnnotation/PA166163433		PA166163433	Annotation of FDA Label for eteplirsen and DMD	FDA	On FDA Biomarker List	Testing Required							eteplirsen	DMD		8/21/2023
https://www.pharmgkb.org/labelAnnotation/PA166183172		PA166183172	"Annotation of EMA Label for lapatinib and HLA-DQA1, HLA-DRB1"	EMA		Informative PGx							lapatinib	HLA-DQA1; HLA-DRB1	HLA-DQA1*02:01; HLA-DRB1*07:01	
https://www.pharmgkb.org/labelAnnotation/PA166183220		PA166183220	"Annotation of EMA Label for neratinib and ERBB2, ESR1, ESR2, PGR"	EMA		Testing Required					Cancer Genome		neratinib	ERBB2; ESR1; ESR2; PGR		4/21/2024
https://www.pharmgkb.org/labelAnnotation/PA166160153		PA166160153	Annotation of PMDA Label for celecoxib and CYP2C9	PMDA		Actionable PGx							celecoxib	CYP2C9		
https://www.pharmgkb.org/labelAnnotation/PA166160226		PA166160226	Annotation of PMDA Label for codeine and CYP2D6	PMDA		Actionable PGx							codeine	CYP2D6		
https://www.pharmgkb.org/labelAnnotation/PA166160683		PA166160683	Annotation of PMDA Label for dapsone and G6PD	PMDA		Actionable PGx							dapsone	G6PD		
https://www.pharmgkb.org/labelAnnotation/PA166160162		PA166160162	Annotation of PMDA Label for efavirenz and CYP2B6	PMDA		Actionable PGx							efavirenz	CYP2B6		
https://www.pharmgkb.org/labelAnnotation/PA166160712		PA166160712	Annotation of PMDA Label for fesoterodine and CYP2D6	PMDA		Actionable PGx							fesoterodine	CYP2D6		
https://www.pharmgkb.org/labelAnnotation/PA166160717		PA166160717	Annotation of PMDA Label for letrozole and CYP2A6	PMDA		Actionable PGx							letrozole	CYP2A6		
https://www.pharmgkb.org/labelAnnotation/PA166160719		PA166160719	Annotation of PMDA Label for nalidixic acid and G6PD	PMDA		Actionable PGx							nalidixic acid	G6PD		
https://www.pharmgkb.org/labelAnnotation/PA166160845		PA166160845	Annotation of PMDA Label for perphenazine and CYP2D6	PMDA		Actionable PGx							perphenazine	CYP2D6		
https://www.pharmgkb.org/labelAnnotation/PA166160846		PA166160846	Annotation of PMDA Label for rabeprazole and CYP2C19	PMDA		Actionable PGx							rabeprazole	CYP2C19		
https://www.pharmgkb.org/labelAnnotation/PA166160847		PA166160847	Annotation of PMDA Label for sulfadiazine and G6PD	PMDA		Actionable PGx							sulfadiazine	G6PD		
https://www.pharmgkb.org/labelAnnotation/PA166160848		PA166160848	Annotation of PMDA Label for sulfamethoxazole / trimethoprim and G6PD	PMDA		Actionable PGx							sulfamethoxazole / trimethoprim	G6PD		
https://www.pharmgkb.org/labelAnnotation/PA166160849		PA166160849	Annotation of PMDA Label for sulfasalazine and G6PD	PMDA		Actionable PGx							sulfasalazine	G6PD		
https://www.pharmgkb.org/labelAnnotation/PA166160850		PA166160850	Annotation of PMDA Label for tetrabenazine and CYP2D6	PMDA		Actionable PGx							tetrabenazine	CYP2D6		
https://www.pharmgkb.org/labelAnnotation/PA166160854		PA166160854	Annotation of PMDA Label for moviprep and G6PD	PMDA		Actionable PGx							moviprep	G6PD		
https://www.pharmgkb.org/labelAnnotation/PA166160856		PA166160856	Annotation of PMDA Label for voriconazole and CYP2C19	PMDA		Actionable PGx							voriconazole	CYP2C19		
https://www.pharmgkb.org/labelAnnotation/PA166160709		PA166160709	Annotation of PMDA Label for eliglustat and CYP2D6	PMDA		Testing Required							eliglustat	CYP2D6		
https://www.pharmgkb.org/labelAnnotation/PA166160710		PA166160710	Annotation of PMDA Label for erlotinib and EGFR	PMDA		Testing Required							erlotinib	EGFR		
https://www.pharmgkb.org/labelAnnotation/PA166160851		PA166160851	Annotation of PMDA Label for vemurafenib and BRAF	PMDA		Testing Required							vemurafenib	BRAF		
https://www.pharmgkb.org/labelAnnotation/PA166160669		PA166160669	"Annotation of PMDA Label for escitalopram and CYP2C19, CYP2D6"	PMDA		Actionable PGx							escitalopram	CYP2C19; CYP2D6		
https://www.pharmgkb.org/labelAnnotation/PA166152939		PA166152939	Annotation of FDA Label for ivacaftor / lumacaftor and CFTR	FDA	On FDA Biomarker List	Testing Required							ivacaftor / lumacaftor	CFTR	rs113993960	10/5/2023
https://www.pharmgkb.org/labelAnnotation/PA166179870		PA166179870	Annotation of FDA Label for binimetinib and BRAF	FDA	On FDA Biomarker List	Testing Required					Cancer Genome		binimetinib	BRAF	rs113488022	10/25/2023
https://www.pharmgkb.org/labelAnnotation/PA166183881		PA166183881	Annotation of Swissmedic Label for mivacurium and BCHE	Swissmedic		Actionable PGx							mivacurium	BCHE		11/15/2022
https://www.pharmgkb.org/labelAnnotation/PA166184130		PA166184130	Annotation of Swissmedic Label for dapoxetine and CYP2D6	Swissmedic		Actionable PGx	Prescribing Info	Dosing Info				Prescribing	dapoxetine	CYP2D6		
https://www.pharmgkb.org/labelAnnotation/PA166184115		PA166184115	Annotation of Swissmedic Label for carbamazepine and HLA-A	Swissmedic		Testing Recommended	Prescribing Info		Alternate Drug			Prescribing	carbamazepine	HLA-A	HLA-A*31:01	2/28/2023
https://www.pharmgkb.org/labelAnnotation/PA166184445		PA166184445	Annotation of Swissmedic Label for escitalopram and CYP2C19	Swissmedic		Actionable PGx	Prescribing Info	Dosing Info				Prescribing	escitalopram	CYP2C19		2/28/2023
https://www.pharmgkb.org/labelAnnotation/PA166184378		PA166184378	Annotation of Swissmedic Label for irinotecan and UGT1A1	Swissmedic		Actionable PGx	Prescribing Info	Dosing Info				Prescribing	irinotecan	UGT1A1	UGT1A1*28	2/28/2023
https://www.pharmgkb.org/labelAnnotation/PA166183901		PA166183901	Annotation of Swissmedic Label for moxifloxacin and G6PD	Swissmedic		Actionable PGx	Prescribing Info					Prescribing	moxifloxacin	G6PD		2/28/2023
https://www.pharmgkb.org/labelAnnotation/PA166184082		PA166184082	Annotation of Swissmedic Label for nicorandil and G6PD	Swissmedic		Actionable PGx	Prescribing Info					Prescribing	nicorandil	G6PD		2/28/2023
https://www.pharmgkb.org/labelAnnotation/PA166184128		PA166184128	Annotation of Swissmedic Label for acetaminophen / codeine and G6PD	Swissmedic		Actionable PGx							acetaminophen / codeine	G6PD		
https://www.pharmgkb.org/labelAnnotation/PA166184109		PA166184109	Annotation of Swissmedic Label for aripiprazole and CYP2D6	Swissmedic		Actionable PGx							aripiprazole	CYP2D6		
https://www.pharmgkb.org/labelAnnotation/PA166184119		PA166184119	Annotation of Swissmedic Label for celecoxib and CYP2C9	Swissmedic		Actionable PGx							celecoxib	CYP2C9	CYP2C9*1; CYP2C9*3	
https://www.pharmgkb.org/labelAnnotation/PA166184131		PA166184131	Annotation of Swissmedic Label for darifenacin and CYP2D6	Swissmedic		Actionable PGx							darifenacin	CYP2D6		
https://www.pharmgkb.org/labelAnnotation/PA166184444		PA166184444	Annotation of Swissmedic Label for eletriptan and CYP2D6	Swissmedic		Informative PGx							eletriptan	CYP2D6		
https://www.pharmgkb.org/labelAnnotation/PA166184448		PA166184448	Annotation of Swissmedic Label for flucloxacillin and HLA-B	Swissmedic		Actionable PGx							flucloxacillin	HLA-B	HLA-B*57:01	
https://www.pharmgkb.org/labelAnnotation/PA166184108		PA166184108	Annotation of Swissmedic Label for fluorouracil / salicylic acid and DPYD	Swissmedic		Testing Recommended							fluorouracil / salicylic acid	DPYD		
https://www.pharmgkb.org/labelAnnotation/PA166184453		PA166184453	Annotation of Swissmedic Label for fluvoxamine and CYP2D6	Swissmedic		Actionable PGx							fluvoxamine	CYP2D6		
https://www.pharmgkb.org/labelAnnotation/PA166184458		PA166184458	Annotation of Swissmedic Label for glimepiride and G6PD	Swissmedic		Actionable PGx							glimepiride	G6PD		
https://www.pharmgkb.org/labelAnnotation/PA166184377		PA166184377	Annotation of Swissmedic Label for indacaterol and UGT1A1	Swissmedic		Informative PGx							indacaterol	UGT1A1	UGT1A1*28	
https://www.pharmgkb.org/labelAnnotation/PA166184382		PA166184382	Annotation of Swissmedic Label for lansoprazole and CYP2C19	Swissmedic		Actionable PGx							lansoprazole	CYP2C19		
https://www.pharmgkb.org/labelAnnotation/PA166184385		PA166184385	Annotation of Swissmedic Label for lesinurad and CYP2C9	Swissmedic		Informative PGx							lesinurad	CYP2C9	CYP2C9*1; CYP2C9*3	
https://www.pharmgkb.org/labelAnnotation/PA166183790		PA166183790	Annotation of Swissmedic Label for metoprolol and CYP2D6	Swissmedic		Actionable PGx							metoprolol	CYP2D6		
https://www.pharmgkb.org/labelAnnotation/PA166183810		PA166183810	Annotation of Swissmedic Label for mirabegron and CYP2D6	Swissmedic		Informative PGx							mirabegron	CYP2D6		
https://www.pharmgkb.org/labelAnnotation/PA166184118		PA166184118	Annotation of Swissmedic Label for carvedilol and CYP2D6	Swissmedic		Informative PGx							carvedilol	CYP2D6		8/15/2023
https://www.pharmgkb.org/labelAnnotation/PA166184127		PA166184127	Annotation of Swissmedic Label for acetaminophen / codeine and CYP2D6	Swissmedic		Testing Required	Prescribing Info		Alternate Drug			Prescribing	acetaminophen / codeine	CYP2D6		4/15/2024
https://www.pharmgkb.org/labelAnnotation/PA166182947		PA166182947	Annotation of EMA Label for elosulfase alfa and GALNS	EMA		Testing Required							elosulfase alfa	GALNS		4/16/2024
https://www.pharmgkb.org/labelAnnotation/PA166182929		PA166182929	Annotation of EMA Label for binimetinib and UGT1A1	EMA		No Clinical PGx							binimetinib	UGT1A1		8/14/2023
https://www.pharmgkb.org/labelAnnotation/PA166184156		PA166184156	Annotation of Swissmedic Label for norfloxacin and G6PD	Swissmedic		Actionable PGx							norfloxacin	G6PD		
https://www.pharmgkb.org/labelAnnotation/PA166184459		PA166184459	Annotation of Swissmedic Label for nitroglycerin and G6PD	Swissmedic		Actionable PGx							nitroglycerin	G6PD		
https://www.pharmgkb.org/labelAnnotation/PA166184159		PA166184159	Annotation of Swissmedic Label for omeprazole and CYP2C19	Swissmedic		Actionable PGx							omeprazole	CYP2C19		
https://www.pharmgkb.org/labelAnnotation/PA166184222		PA166184222	Annotation of Swissmedic Label for pantoprazole and CYP2C19	Swissmedic		Informative PGx							pantoprazole	CYP2C19		
https://www.pharmgkb.org/labelAnnotation/PA166182930		PA166182930	Annotation of EMA Label for brexpiprazole and CYP2D6	EMA		Actionable PGx	Prescribing Info	Dosing Info				Prescribing	brexpiprazole	CYP2D6		
https://www.pharmgkb.org/labelAnnotation/PA166184402		PA166184402	Annotation of Swissmedic Label for ranolazine and CYP2D6	Swissmedic		Actionable PGx	Prescribing Info					Prescribing	ranolazine	CYP2D6		
https://www.pharmgkb.org/labelAnnotation/PA166184373		PA166184373	Annotation of Swissmedic Label for piroxicam and CYP2C9	Swissmedic		Actionable PGx							piroxicam	CYP2C9	CYP2C9*2; CYP2C9*3	
https://www.pharmgkb.org/labelAnnotation/PA166184381		PA166184381	Annotation of Swissmedic Label for prilocaine and G6PD	Swissmedic		Actionable PGx							prilocaine	G6PD		
https://www.pharmgkb.org/labelAnnotation/PA166184234		PA166184234	Annotation of Swissmedic Label for vernakalant and CYP2D6	Swissmedic		Informative PGx							vernakalant	CYP2D6		
https://www.pharmgkb.org/labelAnnotation/PA166184504		PA166184504	Annotation of Swissmedic Label for zidovudine / lamivudine / abacavir and HLA-B	Swissmedic		Testing Required	Prescribing Info					Prescribing	zidovudine / lamivudine / abacavir	HLA-B	HLA-B*57:01	2/28/2023
https://www.pharmgkb.org/labelAnnotation/PA166184110		PA166184110	Annotation of Swissmedic Label for vitamin c and G6PD	Swissmedic		Actionable PGx	Prescribing Info	Dosing Info				Prescribing	vitamin c	G6PD		2/28/2023
https://www.pharmgkb.org/labelAnnotation/PA166182926		PA166182926	Annotation of EMA Label for atezolizumab and CD274	EMA		Testing Required					Cancer Genome		atezolizumab	CD274		4/15/2024
https://www.pharmgkb.org/labelAnnotation/PA166184441		PA166184441	"Annotation of Swissmedic Label for dolutegravir and CYP3A4, CYP3A5, NR1I2, UGT1A1"	Swissmedic		Informative PGx							dolutegravir	CYP3A4; CYP3A5; NR1I2; UGT1A1		8/15/2023
https://www.pharmgkb.org/labelAnnotation/PA166182924		PA166182924	Annotation of EMA Label for alectinib and ALK	EMA		Testing Required					Cancer Genome		alectinib	ALK		4/15/2024
https://www.pharmgkb.org/labelAnnotation/PA166182951		PA166182951	Annotation of EMA Label for glyburide and G6PD	EMA		Actionable PGx	Prescribing Info		Alternate Drug	Other Prescribing Guidance		Prescribing	glyburide	G6PD		7/22/2024
https://www.pharmgkb.org/labelAnnotation/PA166183183		PA166183183	"Annotation of EMA Label for lidocaine / prilocaine and CYB5R3, G6PD"	EMA		Actionable PGx	Prescribing Info			Other Prescribing Guidance		Prescribing	lidocaine / prilocaine	CYB5R3; G6PD		7/23/2024
https://www.pharmgkb.org/labelAnnotation/PA166182950		PA166182950	Annotation of EMA Label for gefitinib and CYP2D6	EMA		Actionable PGx	Prescribing Info			Other Prescribing Guidance		Prescribing	gefitinib	CYP2D6		8/7/2024
https://www.pharmgkb.org/labelAnnotation/PA166182945		PA166182945	Annotation of EMA Label for efavirenz and CYP2B6	EMA		Informative PGx							efavirenz	CYP2B6	CYP2B6*1; CYP2B6*6; rs3745274	
https://www.pharmgkb.org/labelAnnotation/PA166183171		PA166183171	Annotation of EMA Label for lacosamide and CYP2C19	EMA		No Clinical PGx							lacosamide	CYP2C19		
https://www.pharmgkb.org/labelAnnotation/PA166183247		PA166183247	"Annotation of EMA Label for palbociclib and ERBB2, ESR1, ESR2, PGR"	EMA		Testing Required					Cancer Genome		palbociclib	ERBB2; ESR1; ESR2; PGR		4/21/2024
https://www.pharmgkb.org/labelAnnotation/PA166105319		PA166105319	"Annotation of EMA Label for panitumumab and KRAS, NRAS"	EMA		Testing Required					Cancer Genome		panitumumab	KRAS; NRAS		4/21/2024
https://www.pharmgkb.org/labelAnnotation/PA166122067		PA166122067	"Annotation of EMA Label for ponatinib and ABL1, BCR"	EMA		Testing Required					Cancer Genome		ponatinib	ABL1; BCR		4/21/2024
https://www.pharmgkb.org/labelAnnotation/PA166277781		PA166277781	Annotation of EMA Label for tebentafusp and HLA-A	EMA		Testing Required							tebentafusp	HLA-A	HLA-A*02:01	8/14/2024
https://www.pharmgkb.org/labelAnnotation/PA166272661		PA166272661	"Annotation of HCSC Label for abemaciclib and ERBB2, ESR1, ESR2"	HCSC		Testing Required					Cancer Genome		abemaciclib	ERBB2; ESR1; ESR2		8/26/2024
https://www.pharmgkb.org/labelAnnotation/PA166184123		PA166184123	"Annotation of Swissmedic Label for citalopram and CYP2C19, CYP2D6"	Swissmedic		Actionable PGx	Prescribing Info	Dosing Info				Prescribing	citalopram	CYP2C19; CYP2D6		2/28/2023
https://www.pharmgkb.org/labelAnnotation/PA166184345		PA166184345	"Annotation of Swissmedic Label for phenytoin and CYP2C9, HLA-B"	Swissmedic		Actionable PGx	Prescribing Info	Dosing Info				Prescribing	phenytoin	CYP2C9; HLA-B	HLA-B*15:02	2/28/2023
https://www.pharmgkb.org/labelAnnotation/PA166184424		PA166184424	Annotation of Swissmedic Label for thioguanine and TPMT	Swissmedic		Actionable PGx	Prescribing Info	Dosing Info				Prescribing	thioguanine	TPMT		2/28/2023
https://www.pharmgkb.org/labelAnnotation/PA166160039		PA166160039	Annotation of FDA Label for evolocumab	FDA	On FDA Biomarker List								evolocumab			9/7/2023
https://www.pharmgkb.org/labelAnnotation/PA166293361		PA166293361	Annotation of FDA Label for desmopressin and F8	FDA	On FDA Biomarker List	Testing Required							desmopressin	F8		8/21/2023
https://www.pharmgkb.org/labelAnnotation/PA166293681		PA166293681	"Annotation of FDA Label for trastuzumab deruxtecan and ESR1, ESR2"	FDA	On FDA Biomarker List						Cancer Genome		trastuzumab deruxtecan	ESR1; ESR2		9/28/2023
https://www.pharmgkb.org/labelAnnotation/PA166163412		PA166163412	Annotation of FDA Label for ombitasvir / paritaprevir / ritonavir and IFNL3	FDA	On FDA Biomarker List								ombitasvir / paritaprevir / ritonavir	IFNL3		9/7/2023
https://www.pharmgkb.org/labelAnnotation/PA166163435		PA166163435	Annotation of FDA Label for olaratumab and PDGFRA	FDA	On FDA Biomarker List						Cancer Genome		olaratumab	PDGFRA		8/23/2023
https://www.pharmgkb.org/labelAnnotation/PA166235881		PA166235881	Annotation of FDA Label for margetuximab and ERBB2	FDA	On FDA Biomarker List	Testing Required					Cancer Genome		margetuximab	ERBB2		8/31/2023
https://www.pharmgkb.org/labelAnnotation/PA166293742		PA166293742	Annotation of FDA Label for mirvetuximab soravtansine and FOLR1	FDA	On FDA Biomarker List	Testing Required					Cancer Genome		mirvetuximab soravtansine	FOLR1		8/31/2023
https://www.pharmgkb.org/labelAnnotation/PA166293921		PA166293921	Annotation of FDA Label for olutasidenib and IDH1	FDA	On FDA Biomarker List	Testing Required					Cancer Genome		olutasidenib	IDH1	rs121913499; rs121913500	8/31/2023
https://www.pharmgkb.org/labelAnnotation/PA166294401		PA166294401	Annotation of HCSC Label for evolocumab	HCSC									evolocumab			8/14/2024
https://www.pharmgkb.org/labelAnnotation/PA166293301		PA166293301	"Annotation of FDA Label for betaine and CBS, MMADHC, MTHFR"	FDA	On FDA Biomarker List								betaine	CBS; MMADHC; MTHFR		8/5/2024
https://www.pharmgkb.org/labelAnnotation/PA166293961		PA166293961	"Annotation of HCSC Label for betaine and CBS, MMADHC, MTHFR"	HCSC									betaine	CBS; MMADHC; MTHFR		8/5/2024
https://www.pharmgkb.org/labelAnnotation/PA166293981		PA166293981	Annotation of HCSC Label for desmopressin and F8	HCSC		Testing Required							desmopressin	F8		4/16/2024
https://www.pharmgkb.org/labelAnnotation/PA166293941		PA166293941	"Annotation of EMA Label for betaine and CBS, MMADHC, MTHFR"	EMA									betaine	CBS; MMADHC; MTHFR		8/5/2024
https://www.pharmgkb.org/labelAnnotation/PA166294041		PA166294041	Annotation of EMA Label for durvalumab and CD274	EMA		Testing Required					Cancer Genome		durvalumab	CD274		5/10/2024
https://www.pharmgkb.org/labelAnnotation/PA166294981		PA166294981	Annotation of EMA Label for pemigatinib and FGFR2	EMA		Testing Required					Cancer Genome		pemigatinib	FGFR2		
https://www.pharmgkb.org/labelAnnotation/PA166295001		PA166295001	Annotation of HCSC Label for pemigatinib and FGFR2	HCSC		Testing Required					Cancer Genome		pemigatinib	FGFR2		
https://www.pharmgkb.org/labelAnnotation/PA166104811		PA166104811	Annotation of FDA Label for quinidine and CYP2D6	FDA	On FDA Biomarker List								quinidine	CYP2D6		9/7/2023
https://www.pharmgkb.org/labelAnnotation/PA166104845		PA166104845	Annotation of FDA Label for dapsone and CYB5R3	FDA	On FDA Biomarker List	Actionable PGx	Prescribing Info		Alternate Drug			Prescribing	dapsone	CYB5R3		7/19/2024
https://www.pharmgkb.org/labelAnnotation/PA166295822		PA166295822	Annotation of FDA Label for teclistamab	FDA	On FDA Biomarker List						Cancer Genome		teclistamab			8/24/2023
https://www.pharmgkb.org/labelAnnotation/PA166104788		PA166104788	Annotation of FDA Label for fluoxetine / olanzapine and CYP2D6	FDA		Informative PGx							fluoxetine / olanzapine	CYP2D6		12/17/2013
https://www.pharmgkb.org/labelAnnotation/PA166104789		PA166104789	Annotation of FDA Label for gefitinib and EGFR	FDA	On FDA Biomarker List	Testing Required					Cancer Genome		gefitinib	EGFR	rs121434568	9/1/2023
https://www.pharmgkb.org/labelAnnotation/PA166104833		PA166104833	Annotation of FDA Label for abacavir and HLA-B	FDA	On FDA Biomarker List	Testing Required	Prescribing Info		Alternate Drug			Prescribing	abacavir	HLA-B	HLA-B*57:01	5/8/2019
https://www.pharmgkb.org/labelAnnotation/PA166104812		PA166104812	Annotation of FDA Label for protriptyline and CYP2D6	FDA	On FDA Biomarker List	Informative PGx							protriptyline	CYP2D6		10/25/2013
https://www.pharmgkb.org/labelAnnotation/PA166104806		PA166104806	Annotation of FDA Label for tolterodine and CYP2D6	FDA	On FDA Biomarker List	Informative PGx							tolterodine	CYP2D6		10/25/2013
https://www.pharmgkb.org/labelAnnotation/PA166104826		PA166104826	"Annotation of FDA Label for cetuximab and BRAF, EGFR, KRAS, NRAS"	FDA	On FDA Biomarker List	Testing Required					Cancer Genome		cetuximab	BRAF; EGFR; KRAS; NRAS		9/1/2023
https://www.pharmgkb.org/labelAnnotation/PA166104784		PA166104784	Annotation of FDA Label for diazepam and CYP2C19	FDA	On FDA Biomarker List	Informative PGx							diazepam	CYP2C19		12/11/2023
https://www.pharmgkb.org/labelAnnotation/PA166104831		PA166104831	Annotation of FDA Label for irinotecan and UGT1A1	FDA	On FDA Biomarker List	Testing Recommended	Prescribing Info	Dosing Info		Other Prescribing Guidance		Prescribing	irinotecan	UGT1A1	UGT1A1*28; UGT1A1*6	8/30/2024
https://www.pharmgkb.org/labelAnnotation/PA166104828		PA166104828	Annotation of FDA Label for hydralazine / isosorbide dinitrate and NAT2	FDA	On FDA Biomarker List	Informative PGx							hydralazine / isosorbide dinitrate	NAT2		9/8/2023
