url	label_history	PharmGKB ID	Name	Source	Biomarker Flag	Testing Level	Has Prescribing Info	Has Dosing Info	Has Alternate Drug	Has Other Prescribing Guidance	Cancer Genome	Prescribing	Chemicals	Genes	Variants/Haplotypes	Latest History Date (YYYY-MM-DD)
https://www.pharmgkb.org/labelAnnotation/PA166269401		PA166269401	Annotation of EMA Label for nateglinide and CYP2C9	EMA									nateglinide	CYP2C9		11/21/2023
https://www.pharmgkb.org/labelAnnotation/PA166269701		PA166269701	"Annotation of EMA Label for glycerol phenylbutyrate and ARG1, ASL, ASS1, CPS1, OTC"	EMA		Testing Required							glycerol phenylbutyrate	ARG1; ASL; ASS1; CPS1; OTC		8/7/2024
https://www.pharmgkb.org/labelAnnotation/PA166273281		PA166273281	Annotation of EMA Label for nusinersen and SMN2	EMA									nusinersen	SMN2		8/17/2023
https://www.pharmgkb.org/labelAnnotation/PA166273261		PA166273261	Annotation of EMA Label for ospemifene and CYP2C9	EMA									ospemifene	CYP2C9		8/16/2024
https://www.pharmgkb.org/labelAnnotation/PA166271261		PA166271261	Annotation of EMA Label for tegafur / gimeracil / oteracil and DPYD	EMA		Testing Recommended	Prescribing Info		Alternate Drug			Prescribing	tegafur / gimeracil / oteracil	DPYD	"DPYD c.1129-5923C>G, c.1236G>A (HapB3); DPYD c.1679T>G (*13); DPYD c.1905+1G>A (*2A); DPYD c.2846A>T"	
https://www.pharmgkb.org/labelAnnotation/PA166273521		PA166273521	"Annotation of EMA Label for ipilimumab and ALK, CD274, EGFR"	EMA		Testing Required					Cancer Genome		ipilimumab	ALK; CD274; EGFR		4/21/2024
https://www.pharmgkb.org/labelAnnotation/PA166273423		PA166273423	"Annotation of EMA Label for lutetium (177Lu) oxodotreotide and SSTR1, SSTR2, SSTR3, SSTR4, SSTR5"	EMA		Testing Required					Cancer Genome		lutetium (177Lu) oxodotreotide	SSTR1; SSTR2; SSTR3; SSTR4; SSTR5		8/8/2024
https://www.pharmgkb.org/labelAnnotation/PA166273501		PA166273501	"Annotation of EMA Label for ipilimumab and CTLA4, HLA-A"	EMA		No Clinical PGx							ipilimumab	CTLA4; HLA-A	HLA-A*02:01	8/7/2024
https://www.pharmgkb.org/labelAnnotation/PA166272241		PA166272241	Annotation of HCSC Label for upadacitinib and CYP2D6	HCSC		No Clinical PGx							upadacitinib	CYP2D6		
https://www.pharmgkb.org/labelAnnotation/PA166272321		PA166272321	"Annotation of HCSC Label for tipiracil / trifluridine and ERBB2, KRAS"	HCSC							Cancer Genome		tipiracil / trifluridine	ERBB2; KRAS		8/27/2023
https://www.pharmgkb.org/labelAnnotation/PA166271361		PA166271361	Annotation of HCSC Label for capmatinib and MET	HCSC		Testing Required					Cancer Genome		capmatinib	MET		4/16/2024
https://www.pharmgkb.org/labelAnnotation/PA166272581		PA166272581	Annotation of HCSC Label for sotorasib and KRAS	HCSC		Testing Required					Cancer Genome		sotorasib	KRAS	rs121913530	8/13/2024
https://www.pharmgkb.org/labelAnnotation/PA166272601		PA166272601	Annotation of EMA Label for sotorasib and KRAS	EMA		Testing Required					Cancer Genome		sotorasib	KRAS	rs121913530	8/13/2024
https://www.pharmgkb.org/labelAnnotation/PA166271481		PA166271481	Annotation of HCSC Label for escitalopram and CYP2C19	HCSC		Actionable PGx	Prescribing Info	Dosing Info				Prescribing	escitalopram	CYP2C19		8/14/2024
https://www.pharmgkb.org/labelAnnotation/PA166184114		PA166184114	Annotation of Swissmedic Label for capecitabine and DPYD	Swissmedic		Actionable PGx	Prescribing Info	Dosing Info	Alternate Drug			Prescribing	capecitabine	DPYD		2/28/2023
https://www.pharmgkb.org/labelAnnotation/PA166184117		PA166184117	Annotation of Swissmedic Label for carbasalate calcium and G6PD	Swissmedic		Actionable PGx							carbasalate calcium	G6PD		9/30/2022
https://www.pharmgkb.org/labelAnnotation/PA166184126		PA166184126	Annotation of Swissmedic Label for codeine and CYP2D6	Swissmedic		Actionable PGx	Prescribing Info		Alternate Drug			Prescribing	codeine	CYP2D6		
https://www.pharmgkb.org/labelAnnotation/PA166184405		PA166184405	Annotation of Swissmedic Label for brexpiprazole and CYP2D6	Swissmedic		Actionable PGx	Prescribing Info	Dosing Info				Prescribing	brexpiprazole	CYP2D6		
https://www.pharmgkb.org/labelAnnotation/PA166184116		PA166184116	Annotation of Swissmedic Label for carbamazepine and HLA-B	Swissmedic		Testing Required	Prescribing Info		Alternate Drug			Prescribing	carbamazepine	HLA-B	HLA-B*15:02	2/28/2023
https://www.pharmgkb.org/labelAnnotation/PA166272701		PA166272701	Annotation of EMA Label for rimegepant and CYP2C9	EMA		No Clinical PGx							rimegepant	CYP2C9		8/24/2023
https://www.pharmgkb.org/labelAnnotation/PA166272721		PA166272721	"Annotation of EMA Label for risdiplam and SMN1, SMN2"	EMA		Testing Required							risdiplam	SMN1; SMN2		8/13/2024
https://www.pharmgkb.org/labelAnnotation/PA166271541		PA166271541	Annotation of EMA Label for sacituzumab govitecan and UGT1A1	EMA		Actionable PGx	Prescribing Info			Other Prescribing Guidance		Prescribing	sacituzumab govitecan	UGT1A1	UGT1A1*28	8/13/2024
https://www.pharmgkb.org/labelAnnotation/PA166273981		PA166273981	"Annotation of HCSC Label for asciminib and ABL1, BCR"	HCSC		Testing Required					Cancer Genome		asciminib	ABL1; BCR		8/26/2024
https://www.pharmgkb.org/labelAnnotation/PA166184506		PA166184506	Annotation of Swissmedic Label for dolutegravir / abacavir / lamivudine and HLA-B	Swissmedic		Testing Required	Prescribing Info					Prescribing	dolutegravir / abacavir / lamivudine	HLA-B	HLA-B*57:01	2/28/2023
https://www.pharmgkb.org/labelAnnotation/PA166184122		PA166184122	Annotation of Swissmedic Label for ciprofloxacin and G6PD	Swissmedic		Actionable PGx							ciprofloxacin	G6PD		
https://www.pharmgkb.org/labelAnnotation/PA166184124		PA166184124	Annotation of Swissmedic Label for clomipramine and CYP2D6	Swissmedic		Actionable PGx							clomipramine	CYP2D6		
https://www.pharmgkb.org/labelAnnotation/PA166184133		PA166184133	Annotation of Swissmedic Label for dexlansoprazole and CYP2C19	Swissmedic		Actionable PGx							dexlansoprazole	CYP2C19		
https://www.pharmgkb.org/labelAnnotation/PA166184134		PA166184134	Annotation of Swissmedic Label for dextromethorphan and CYP2D6	Swissmedic		Actionable PGx							dextromethorphan	CYP2D6		
https://www.pharmgkb.org/labelAnnotation/PA166184442		PA166184442	Annotation of Swissmedic Label for duloxetine and CYP2D6	Swissmedic		Actionable PGx							duloxetine	CYP2D6		
https://www.pharmgkb.org/labelAnnotation/PA166184449		PA166184449	Annotation of Swissmedic Label for flucytosine and DPYD	Swissmedic		Testing Recommended							flucytosine	DPYD		
https://www.pharmgkb.org/labelAnnotation/PA166183786		PA166183786	"Annotation of Swissmedic Label for amlodipine / atorvastatin / perindopril arginine and G6PD, SLCO1B1"	Swissmedic		Actionable PGx							amlodipine / atorvastatin / perindopril arginine	G6PD; SLCO1B1	rs4149056	
https://www.pharmgkb.org/labelAnnotation/PA166271561		PA166271561	Annotation of HCSC Label for sacituzumab govitecan and UGT1A1	HCSC		Actionable PGx	Prescribing Info		Alternate Drug	Other Prescribing Guidance		Prescribing	sacituzumab govitecan	UGT1A1	UGT1A1*28	8/13/2024
https://www.pharmgkb.org/labelAnnotation/PA166274002		PA166274002	"Annotation of HCSC Label for blinatumomab and ABL1, BCR, CD19"	HCSC							Cancer Genome		blinatumomab	ABL1; BCR; CD19		5/21/2024
https://www.pharmgkb.org/labelAnnotation/PA166272781		PA166272781	Annotation of EMA Label for selpercatinib and RET	EMA		Testing Required					Cancer Genome		selpercatinib	RET		8/13/2024
https://www.pharmgkb.org/labelAnnotation/PA166272801		PA166272801	"Annotation of EMA Label for setmelanotide and LEPR, PCSK1, POMC"	EMA		Testing Required							setmelanotide	LEPR; PCSK1; POMC		8/13/2024
https://www.pharmgkb.org/labelAnnotation/PA166272821		PA166272821	Annotation of EMA Label for siponimod and CYP2C9	EMA		Testing Required	Prescribing Info	Dosing Info				Prescribing	siponimod	CYP2C9	CYP2C9*1; CYP2C9*11; CYP2C9*2; CYP2C9*3; CYP2C9*5; CYP2C9*6; CYP2C9*8	
https://www.pharmgkb.org/labelAnnotation/PA166272841		PA166272841	Annotation of EMA Label for sodium oxybate and ALDH5A1	EMA		Actionable PGx	Prescribing Info		Alternate Drug			Prescribing	sodium oxybate	ALDH5A1		8/14/2024
https://www.pharmgkb.org/labelAnnotation/PA166273101		PA166273101	Annotation of EMA Label for pitolisant and CYP2D6	EMA		Actionable PGx	Prescribing Info	Dosing Info				Prescribing	pitolisant	CYP2D6		
https://www.pharmgkb.org/labelAnnotation/PA166278442		PA166278442	"Annotation of HCSC Label for cemiplimab-rwlc and ALK, CD274, EGFR, ROS1"	HCSC		Testing Required					Cancer Genome		cemiplimab-rwlc	ALK; CD274; EGFR; ROS1		4/16/2024
https://www.pharmgkb.org/labelAnnotation/PA166278601		PA166278601	Annotation of HCSC Label for selpercatinib and RET	HCSC		Testing Required					Cancer Genome		selpercatinib	RET		8/13/2024
https://www.pharmgkb.org/labelAnnotation/PA166184157		PA166184157	Annotation of Swissmedic Label for ofloxacin and G6PD	Swissmedic		Actionable PGx	Prescribing Info					Prescribing	ofloxacin	G6PD		2/28/2023
https://www.pharmgkb.org/labelAnnotation/PA166184173		PA166184173	Annotation of Swissmedic Label for oxcarbazepine and HLA-B	Swissmedic		Testing Required	Prescribing Info		Alternate Drug			Prescribing	oxcarbazepine	HLA-B	HLA-B*15:02	2/28/2023
https://www.pharmgkb.org/labelAnnotation/PA166184120		PA166184120	Annotation of Swissmedic Label for quinine and G6PD	Swissmedic		Actionable PGx	Prescribing Info		Alternate Drug			Prescribing	quinine	G6PD		2/28/2023
https://www.pharmgkb.org/labelAnnotation/PA166184403		PA166184403	Annotation of Swissmedic Label for rasburicase and G6PD	Swissmedic		Actionable PGx	Prescribing Info		Alternate Drug			Prescribing	rasburicase	G6PD		2/28/2023
https://www.pharmgkb.org/labelAnnotation/PA166184450		PA166184450	Annotation of Swissmedic Label for fluorouracil and DPYD	Swissmedic		Testing Required							fluorouracil	DPYD		
https://www.pharmgkb.org/labelAnnotation/PA166184452		PA166184452	Annotation of Swissmedic Label for fluoxetine and CYP2D6	Swissmedic		Informative PGx							fluoxetine	CYP2D6		
https://www.pharmgkb.org/labelAnnotation/PA166184461		PA166184461	Annotation of Swissmedic Label for hydroxychloroquine and G6PD	Swissmedic		Actionable PGx							hydroxychloroquine	G6PD		
https://www.pharmgkb.org/labelAnnotation/PA166183900		PA166183900	Annotation of Swissmedic Label for moclobemide and CYP2C19	Swissmedic		Actionable PGx							moclobemide	CYP2C19		
https://www.pharmgkb.org/labelAnnotation/PA166183910		PA166183910	Annotation of Swissmedic Label for nebivolol and CYP2D6	Swissmedic		Informative PGx							nebivolol	CYP2D6		
https://www.pharmgkb.org/labelAnnotation/PA166184221		PA166184221	Annotation of Swissmedic Label for palonosetron and CYP2D6	Swissmedic		Informative PGx							palonosetron	CYP2D6		
https://www.pharmgkb.org/labelAnnotation/PA166184268		PA166184268	Annotation of Swissmedic Label for pazopanib and HLA-B	Swissmedic		Actionable PGx							pazopanib	HLA-B	HLA-B*15:02	
https://www.pharmgkb.org/labelAnnotation/PA166184395		PA166184395	Annotation of Swissmedic Label for propafenone and CYP2D6	Swissmedic		Actionable PGx							propafenone	CYP2D6		
https://www.pharmgkb.org/labelAnnotation/PA166184388		PA166184388	"Annotation of Swissmedic Label for losartan and CYP2C9, CYP3A4"	Swissmedic		Actionable PGx							losartan	CYP2C9; CYP3A4		
https://www.pharmgkb.org/labelAnnotation/PA166184390		PA166184390	Annotation of Swissmedic Label for sulfamethoxazole / trimethoprim and G6PD	Swissmedic		Actionable PGx							sulfamethoxazole / trimethoprim	G6PD		
https://www.pharmgkb.org/labelAnnotation/PA166281081		PA166281081	"Annotation of EMA Label for eculizumab and AQP4, CHRNA1, CHRNA3, CHRNA4, CHRNA5, CHRNA6, CHRNA7, CHRNB1, CHRNE"	EMA									eculizumab	AQP4; CHRNA1; CHRNA3; CHRNA4; CHRNA5; CHRNA6; CHRNA7; CHRNB1; CHRNE		9/28/2023
https://www.pharmgkb.org/labelAnnotation/PA166129526		PA166129526	Annotation of HCSC Label for ceritinib and ALK	HCSC		Testing Required					Cancer Genome		ceritinib	ALK		4/16/2024
https://www.pharmgkb.org/labelAnnotation/PA166129527		PA166129527	"Annotation of HCSC Label for ponatinib and ABI1, BCR"	HCSC		Testing Required					Cancer Genome		ponatinib	ABI1; BCR		4/21/2024
https://www.pharmgkb.org/labelAnnotation/PA166129525		PA166129525	Annotation of HCSC Label for carglumic acid and NAGS	HCSC									carglumic acid	NAGS		8/5/2024
https://www.pharmgkb.org/labelAnnotation/PA166281722		PA166281722	Annotation of HCSC Label for pralsetinib and RET	HCSC		Testing Required					Cancer Genome		pralsetinib	RET	rs74799832; rs77709286	8/13/2024
https://www.pharmgkb.org/labelAnnotation/PA166281761		PA166281761	Annotation of HCSC Label for paliperidone and CYP2D6	HCSC		No Clinical PGx							paliperidone	CYP2D6		
https://www.pharmgkb.org/labelAnnotation/PA166283201		PA166283201	Annotation of HCSC Label for mivacurium and BCHE	HCSC		Actionable PGx							mivacurium	BCHE		
https://www.pharmgkb.org/labelAnnotation/PA166283221		PA166283221	Annotation of HCSC Label for lumasiran and AGXT	HCSC									lumasiran	AGXT		8/8/2024
https://www.pharmgkb.org/labelAnnotation/PA166284541		PA166284541	"Annotation of EMA Label for encorafenib and HRAS, KRAS, NRAS"	EMA		Actionable PGx	Prescribing Info		Alternate Drug	Other Prescribing Guidance	Cancer Genome	Prescribing	encorafenib	HRAS; KRAS; NRAS		8/14/2024
https://www.pharmgkb.org/labelAnnotation/PA166283241		PA166283241	Annotation of HCSC Label for lenvatinib	HCSC		Testing Required					Cancer Genome		lenvatinib			4/21/2024
https://www.pharmgkb.org/labelAnnotation/PA166284681		PA166284681	Annotation of EMA Label for pembrolizumab and BRAF	EMA							Cancer Genome		pembrolizumab	BRAF	rs113488022	11/21/2023
https://www.pharmgkb.org/labelAnnotation/PA166283161		PA166283161	"Annotation of HCSC Label for niraparib and BRCA1, BRCA2"	HCSC		Informative PGx					Cancer Genome		niraparib	BRCA1; BRCA2		7/24/2024
https://www.pharmgkb.org/labelAnnotation/PA166284761		PA166284761	Annotation of HCSC Label for cabotegravir / rilpivirine and UGT1A1	HCSC		No Clinical PGx							cabotegravir / rilpivirine	UGT1A1		8/14/2023
https://www.pharmgkb.org/labelAnnotation/PA166284241		PA166284241	Annotation of HCSC Label for fosphenytoin and HLA-B	HCSC		Actionable PGx	Prescribing Info		Alternate Drug			Prescribing	fosphenytoin	HLA-B	HLA-B*15:02	8/14/2024
https://www.pharmgkb.org/labelAnnotation/PA166224081		PA166224081	Annotation of HCSC Label for oxcarbazepine and HLA-A	HCSC		Informative PGx							oxcarbazepine	HLA-A	HLA-A*31:01	7/26/2024
https://www.pharmgkb.org/labelAnnotation/PA166283802		PA166283802	"Annotation of HCSC Label for givosiran and CPOX, HMBS, PPOX"	HCSC									givosiran	CPOX; HMBS; PPOX		8/17/2023
https://www.pharmgkb.org/labelAnnotation/PA166284561		PA166284561	"Annotation of HCSC Label for encorafenib and HRAS, KRAS, NRAS"	HCSC		Actionable PGx	Prescribing Info		Alternate Drug	Other Prescribing Guidance	Cancer Genome	Prescribing	encorafenib	HRAS; KRAS; NRAS		8/14/2024
https://www.pharmgkb.org/labelAnnotation/PA166272361		PA166272361	Annotation of HCSC Label for tafamidis and TTR	HCSC									tafamidis	TTR		8/24/2023
https://www.pharmgkb.org/labelAnnotation/PA166278561		PA166278561	Annotation of HCSC Label for sodium oxybate and ALDH5A1	HCSC		Actionable PGx	Prescribing Info		Alternate Drug			Prescribing	sodium oxybate	ALDH5A1		7/21/2024
https://www.pharmgkb.org/labelAnnotation/PA166283821		PA166283821	"Annotation of HCSC Label for ipilimumab and ALK, CD274, EGFR"	HCSC		Testing Required					Cancer Genome		ipilimumab	ALK; CD274; EGFR		4/21/2024
https://www.pharmgkb.org/labelAnnotation/PA166284721		PA166284721	"Annotation of HCSC Label for nivolumab and ALK, CD274, EGFR, ERBB2"	HCSC		Testing Required					Cancer Genome		nivolumab	ALK; CD274; EGFR; ERBB2		8/9/2024
https://www.pharmgkb.org/labelAnnotation/PA166272341		PA166272341	Annotation of HCSC Label for tepotinib and MET	HCSC		Testing Required					Cancer Genome		tepotinib	MET		8/14/2024
https://www.pharmgkb.org/labelAnnotation/PA166281741		PA166281741	Annotation of HCSC Label for pitolisant and CYP2D6	HCSC		Actionable PGx	Prescribing Info	Dosing Info				Prescribing	pitolisant	CYP2D6		
https://www.pharmgkb.org/labelAnnotation/PA166273302		PA166273302	Annotation of EMA Label for nivolumab and BRAF	EMA							Cancer Genome		nivolumab	BRAF	rs113488022	8/17/2023
https://www.pharmgkb.org/labelAnnotation/PA166283961		PA166283961	Annotation of EMA Label for fosdenopterin and MOCS1	EMA		Testing Required							fosdenopterin	MOCS1		8/6/2024
https://www.pharmgkb.org/labelAnnotation/PA166283941		PA166283941	Annotation of EMA Label for trastuzumab deruxtecan and ERBB2	EMA		Testing Required					Cancer Genome		trastuzumab deruxtecan	ERBB2		8/5/2024
https://www.pharmgkb.org/labelAnnotation/PA166273481		PA166273481	Annotation of EMA Label for isatuximab and CD38	EMA							Cancer Genome		isatuximab	CD38		8/18/2023
https://www.pharmgkb.org/labelAnnotation/PA166283981		PA166283981	Annotation of EMA Label for evinacumab and LDLR	EMA									evinacumab	LDLR		8/20/2024
https://www.pharmgkb.org/labelAnnotation/PA166284001		PA166284001	Annotation of EMA Label for enfortumab vedotin and NECTIN4	EMA							Cancer Genome		enfortumab vedotin	NECTIN4		11/21/2023
https://www.pharmgkb.org/labelAnnotation/PA166284021		PA166284021	Annotation of HCSC Label for enfortumab vedotin and NECTIN4	HCSC							Cancer Genome		enfortumab vedotin	NECTIN4		8/17/2023
https://www.pharmgkb.org/labelAnnotation/PA166277761		PA166277761	Annotation of FDA Label for tebentafusp and HLA-A	FDA	On FDA Biomarker List	Testing Required							tebentafusp	HLA-A	HLA-A*02:01	8/21/2023
https://www.pharmgkb.org/labelAnnotation/PA166229941		PA166229941	"Annotation of HCSC Label for atezolizumab and ALK, CD274, EGFR"	HCSC		Testing Required					Cancer Genome		atezolizumab	ALK; CD274; EGFR		4/15/2024
https://www.pharmgkb.org/labelAnnotation/PA166284062		PA166284062	"Annotation of HCSC Label for entrectinib and NTRK1, NTRK2, NTRK3, ROS1"	HCSC		Testing Required					Cancer Genome		entrectinib	NTRK1; NTRK2; NTRK3; ROS1		4/16/2024
https://www.pharmgkb.org/labelAnnotation/PA166284081		PA166284081	"Annotation of HCSC Label for erdafitinib and FGFR2, FGFR3"	HCSC		Testing Required					Cancer Genome		erdafitinib	FGFR2; FGFR3		4/16/2024
https://www.pharmgkb.org/labelAnnotation/PA166272641		PA166272641	Annotation of EMA Label for tepotinib and MET	EMA		Testing Required					Cancer Genome		tepotinib	MET		8/14/2024
https://www.pharmgkb.org/labelAnnotation/PA166284101		PA166284101	Annotation of HCSC Label for erdafitinib and CYP2C9	HCSC		Actionable PGx	Prescribing Info			Other Prescribing Guidance		Prescribing	erdafitinib	CYP2C9	CYP2C9*3	8/6/2024
https://www.pharmgkb.org/labelAnnotation/PA166278202		PA166278202	"Annotation of EMA Label for azacitidine and KRAS, NRAS, PTPN11"	EMA							Cancer Genome		azacitidine	KRAS; NRAS; PTPN11		8/14/2023
https://www.pharmgkb.org/labelAnnotation/PA166284261		PA166284261	Annotation of HCSC Label for fosphenytoin and CYP2C9	HCSC		No Clinical PGx							fosphenytoin	CYP2C9		
https://www.pharmgkb.org/labelAnnotation/PA166229921		PA166229921	Annotation of HCSC Label for amifampridine and NAT2	HCSC		Actionable PGx	Prescribing Info	Dosing Info				Prescribing	amifampridine	NAT2		
https://www.pharmgkb.org/labelAnnotation/PA166283901		PA166283901	"Annotation of HCSC Label for inclisiran and APOB, LDLR, PCSK9"	HCSC									inclisiran	APOB; LDLR; PCSK9		7/23/2024
https://www.pharmgkb.org/labelAnnotation/PA166273462		PA166273462	Annotation of EMA Label for lenvatinib	EMA							Cancer Genome		lenvatinib			8/18/2023
https://www.pharmgkb.org/labelAnnotation/PA166184172		PA166184172	Annotation of Swissmedic Label for Opium derivatives and expectorants and CYP2D6	Swissmedic		Actionable PGx							Opium derivatives and expectorants	CYP2D6		
https://www.pharmgkb.org/labelAnnotation/PA166184112		PA166184112	"Annotation of Swissmedic Label for azathioprine and NUDT15, TPMT"	Swissmedic		Actionable PGx	Prescribing Info	Dosing Info				Prescribing	azathioprine	NUDT15; TPMT		
https://www.pharmgkb.org/labelAnnotation/PA166184125		PA166184125	Annotation of Swissmedic Label for clopidogrel and CYP2C19	Swissmedic		Actionable PGx	Prescribing Info	Dosing Info				Prescribing	clopidogrel	CYP2C19	CYP2C19*1; CYP2C19*2; CYP2C19*3; CYP2C19*4; CYP2C19*5; CYP2C19*6; CYP2C19*7; CYP2C19*8	11/5/2019
https://www.pharmgkb.org/labelAnnotation/PA166183181		PA166183181	Annotation of EMA Label for lesinurad and CYP2C9	EMA		Actionable PGx	Prescribing Info			Other Prescribing Guidance		Prescribing	lesinurad	CYP2C9	CYP2C9*1; CYP2C9*3	8/14/2024
https://www.pharmgkb.org/labelAnnotation/PA166182948		PA166182948	Annotation of EMA Label for encorafenib and BRAF	EMA		Testing Required					Cancer Genome		encorafenib	BRAF	rs113488022	4/16/2024
https://www.pharmgkb.org/labelAnnotation/PA166182952		PA166182952	Annotation of EMA Label for irinotecan and UGT1A1	EMA		Actionable PGx	Prescribing Info	Dosing Info				Prescribing	irinotecan	UGT1A1	UGT1A1*28	5/31/2024
https://www.pharmgkb.org/labelAnnotation/PA166184121		PA166184121	Annotation of Swissmedic Label for chloroquine and G6PD	Swissmedic		Actionable PGx	Prescribing Info		Alternate Drug			Prescribing	chloroquine	G6PD		2/28/2023
https://www.pharmgkb.org/labelAnnotation/PA166184429		PA166184429	Annotation of Swissmedic Label for ezetimibe / simvastatin and SLCO1B1	Swissmedic		Testing Recommended	Prescribing Info	Dosing Info				Prescribing	ezetimibe / simvastatin	SLCO1B1	rs4149056	2/28/2023
https://www.pharmgkb.org/labelAnnotation/PA166184502		PA166184502	Annotation of Swissmedic Label for lamivudine / abacavir and HLA-B	Swissmedic		Testing Required	Prescribing Info					Prescribing	lamivudine / abacavir	HLA-B	HLA-B*57:01	2/28/2023
https://www.pharmgkb.org/labelAnnotation/PA166184113		PA166184113	Annotation of Swissmedic Label for bisoprolol fumarate / perindopril arginine and G6PD	Swissmedic		Actionable PGx							bisoprolol fumarate / perindopril arginine	G6PD		
https://www.pharmgkb.org/labelAnnotation/PA166184132		PA166184132	Annotation of Swissmedic Label for dasabuvir and IFNL3	Swissmedic		Actionable PGx							dasabuvir	IFNL3		
https://www.pharmgkb.org/labelAnnotation/PA166184443		PA166184443	Annotation of Swissmedic Label for efavirenz and CYP2B6	Swissmedic		Actionable PGx							efavirenz	CYP2B6	CYP2B6*1; CYP2B6*6; rs3745274	
https://www.pharmgkb.org/labelAnnotation/PA166184446		PA166184446	Annotation of Swissmedic Label for escitalopram and CYP2D6	Swissmedic		Informative PGx							escitalopram	CYP2D6		
https://www.pharmgkb.org/labelAnnotation/PA166184447		PA166184447	Annotation of Swissmedic Label for fesoterodine and CYP2D6	Swissmedic		Actionable PGx							fesoterodine	CYP2D6		
https://www.pharmgkb.org/labelAnnotation/PA166184451		PA166184451	Annotation of Swissmedic Label for fluorouracil and TYMS	Swissmedic		Actionable PGx							fluorouracil	TYMS	rs45445694	
https://www.pharmgkb.org/labelAnnotation/PA166184455		PA166184455	Annotation of Swissmedic Label for gefitinib and CYP2D6	Swissmedic		Actionable PGx							gefitinib	CYP2D6		
https://www.pharmgkb.org/labelAnnotation/PA166184457		PA166184457	Annotation of Swissmedic Label for gliclazide and G6PD	Swissmedic		Actionable PGx							gliclazide	G6PD		
https://www.pharmgkb.org/labelAnnotation/PA166184374		PA166184374	Annotation of Swissmedic Label for ibrutinib and CYP2D6	Swissmedic		Informative PGx							ibrutinib	CYP2D6		
https://www.pharmgkb.org/labelAnnotation/PA166184383		PA166184383	"Annotation of Swissmedic Label for lapatinib and HLA-DQA1, HLA-DRB1"	Swissmedic		Actionable PGx							lapatinib	HLA-DQA1; HLA-DRB1	HLA-DQA1*02:01; HLA-DRB1*07:01	
https://www.pharmgkb.org/labelAnnotation/PA166184427		PA166184427	"Annotation of Swissmedic Label for ezetimibe / rosuvastatin and ABCG2, SLCO1B1"	Swissmedic		Actionable PGx	Prescribing Info	Dosing Info				Prescribing	ezetimibe / rosuvastatin	ABCG2; SLCO1B1	rs2231142; rs4149056	8/13/2024
https://www.pharmgkb.org/labelAnnotation/PA166184155		PA166184155	Annotation of Swissmedic Label for nitrofurantoin and G6PD	Swissmedic		Actionable PGx	Prescribing Info		Alternate Drug			Prescribing	nitrofurantoin	G6PD		
https://www.pharmgkb.org/labelAnnotation/PA166184500		PA166184500	Annotation of Swissmedic Label for simvastatin and SLCO1B1	Swissmedic		Testing Recommended	Prescribing Info					Prescribing	simvastatin	SLCO1B1	rs4149056	2/28/2023
https://www.pharmgkb.org/labelAnnotation/PA166184160		PA166184160	Annotation of Swissmedic Label for ondansetron and CYP2D6	Swissmedic		Informative PGx							ondansetron	CYP2D6		
https://www.pharmgkb.org/labelAnnotation/PA166184177		PA166184177	Annotation of Swissmedic Label for oxycodone and CYP2D6	Swissmedic		Actionable PGx							oxycodone	CYP2D6		
https://www.pharmgkb.org/labelAnnotation/PA166184220		PA166184220	Annotation of Swissmedic Label for paliperidone and CYP2D6	Swissmedic		Informative PGx							paliperidone	CYP2D6		
https://www.pharmgkb.org/labelAnnotation/PA166184286		PA166184286	Annotation of Swissmedic Label for perindopril and G6PD	Swissmedic		Actionable PGx							perindopril	G6PD		
https://www.pharmgkb.org/labelAnnotation/PA166184393		PA166184393	Annotation of Swissmedic Label for pitavastatin and SLCO1B1	Swissmedic		Actionable PGx							pitavastatin	SLCO1B1		
https://www.pharmgkb.org/labelAnnotation/PA166184396		PA166184396	Annotation of Swissmedic Label for rabeprazole and CYP2C19	Swissmedic		Actionable PGx							rabeprazole	CYP2C19		
https://www.pharmgkb.org/labelAnnotation/PA166184421		PA166184421	Annotation of Swissmedic Label for risperidone and CYP2D6	Swissmedic		Informative PGx							risperidone	CYP2D6		
https://www.pharmgkb.org/labelAnnotation/PA166184389		PA166184389	Annotation of Swissmedic Label for sulfadiazine and G6PD	Swissmedic		Actionable PGx							sulfadiazine	G6PD		
https://www.pharmgkb.org/labelAnnotation/PA166184392		PA166184392	Annotation of Swissmedic Label for tamoxifen and CYP2D6	Swissmedic		Actionable PGx							tamoxifen	CYP2D6		
