https://www.pharmgkb.org/labelAnnotation/PA166114930		PA166114930	"Annotation of FDA Label for omacetaxine and ABL1, BCR"	FDA	On FDA Biomarker List						Cancer Genome		omacetaxine	ABL1; BCR		8/12/2024
https://www.pharmgkb.org/labelAnnotation/PA166314003		PA166314003	"Annotation of FDA Label for odevixibat and JAG1, NOTCH2"	FDA	On FDA Biomarker List								odevixibat	JAG1; NOTCH2		
https://www.pharmgkb.org/labelAnnotation/PA166313361		PA166313361	"Annotation of FDA Label for elacestrant and ERBB2, ESR1"	FDA	On FDA Biomarker List	Testing Required					Cancer Genome		elacestrant	ERBB2; ESR1		9/27/2023
https://www.pharmgkb.org/labelAnnotation/PA166159962		PA166159962	Annotation of FDA Label for alirocumab and LDLR	FDA	Formerly on FDA Biomarker List								alirocumab	LDLR		2/8/2024
https://www.pharmgkb.org/labelAnnotation/PA166114921		PA166114921	Annotation of FDA Label for ibritumomab and MS4A1	FDA	Formerly on FDA Biomarker List						Cancer Genome		ibritumomab	MS4A1		9/28/2023
https://www.pharmgkb.org/labelAnnotation/PA166281101		PA166281101	"Annotation of HCSC Label for eculizumab and AQP4, CHRNA1, CHRNA3, CHRNA4, CHRNA5, CHRNA6, CHRNA7, CHRNB1, CHRNE"	HCSC									eculizumab	AQP4; CHRNA1; CHRNA3; CHRNA4; CHRNA5; CHRNA6; CHRNA7; CHRNB1; CHRNE		9/28/2023
https://www.pharmgkb.org/labelAnnotation/PA166281121		PA166281121	"Annotation of EMA Label for efgartigimod alfa and CHRNA1, CHRNA3, CHRNA4, CHRNA5, CHRNA6, CHRNA7, CHRNB1, CHRNE"	EMA									efgartigimod alfa	CHRNA1; CHRNA3; CHRNA4; CHRNA5; CHRNA6; CHRNA7; CHRNB1; CHRNE		9/28/2023
https://www.pharmgkb.org/labelAnnotation/PA166273541		PA166273541	Annotation of EMA Label for inebilizumab and AQP4	EMA									inebilizumab	AQP4		9/28/2023
https://www.pharmgkb.org/labelAnnotation/PA166272761		PA166272761	Annotation of EMA Label for satralizumab and AQP4	EMA									satralizumab	AQP4		9/28/2023
https://www.pharmgkb.org/labelAnnotation/PA166272123		PA166272123	Annotation of EMA Label for zanubrutinib and MYD88	EMA							Cancer Genome		zanubrutinib	MYD88		9/28/2023
https://www.pharmgkb.org/labelAnnotation/PA166273081		PA166273081	Annotation of HCSC Label for zanubrutinib and MYD88	HCSC							Cancer Genome		zanubrutinib	MYD88		9/28/2023
https://www.pharmgkb.org/labelAnnotation/PA166277881		PA166277881	"Annotation of FDA Label for ravulizumab and CHRNA1, CHRNA3, CHRNA4, CHRNA5, CHRNA6, CHRNA7, CHRNB1, CHRNE"	FDA	On FDA Biomarker List								ravulizumab	CHRNA1; CHRNA3; CHRNA4; CHRNA5; CHRNA6; CHRNA7; CHRNB1; CHRNE		9/28/2023
https://www.pharmgkb.org/labelAnnotation/PA166182758		PA166182758	"Annotation of FDA Label for goserelin and ESR1, ESR2, PGR"	FDA	On FDA Biomarker List						Cancer Genome		goserelin	ESR1; ESR2; PGR		9/28/2023
https://www.pharmgkb.org/labelAnnotation/PA166272141		PA166272141	Annotation of EMA Label for voxelotor and HBB	EMA									voxelotor	HBB		12/11/2023
https://www.pharmgkb.org/labelAnnotation/PA166278621		PA166278621	Annotation of HCSC Label for satralizumab and AQP4	HCSC									satralizumab	AQP4		9/28/2023
https://www.pharmgkb.org/labelAnnotation/PA166274001		PA166274001	"Annotation of EMA Label for blinatumomab and ABL1, BCR, CD19"	EMA							Cancer Genome		blinatumomab	ABL1; BCR; CD19		5/21/2024
https://www.pharmgkb.org/labelAnnotation/PA166316281		PA166316281	Annotation of FDA Label for trofinetide and MECP2	FDA	On FDA Biomarker List								trofinetide	MECP2		
https://www.pharmgkb.org/labelAnnotation/PA166316301		PA166316301	Annotation of FDA Label for plazomicin and MT-RNR1	FDA	On FDA Biomarker List	Actionable PGx	Prescribing Info		Alternate Drug			Prescribing	plazomicin	MT-RNR1	rs267606617	
https://www.pharmgkb.org/labelAnnotation/PA166316321		PA166316321	Annotation of FDA Label for amikacin and MT-RNR1	FDA	On FDA Biomarker List	Actionable PGx	Prescribing Info		Alternate Drug			Prescribing	amikacin	MT-RNR1	rs267606617	
https://www.pharmgkb.org/labelAnnotation/PA166316341		PA166316341	Annotation of FDA Label for tobramycin and MT-RNR1	FDA	On FDA Biomarker List	Actionable PGx	Prescribing Info		Alternate Drug			Prescribing	tobramycin	MT-RNR1	rs267606617	
https://www.pharmgkb.org/labelAnnotation/PA166317541		PA166317541	Annotation of EMA Label for ganaxolone and CDKL5	EMA		Testing Required							ganaxolone	CDKL5		
https://www.pharmgkb.org/labelAnnotation/PA166317601		PA166317601	Annotation of EMA Label for futibatinib and FGFR2	EMA		Testing Required					Cancer Genome		futibatinib	FGFR2	rs1057519045; rs1057519797	10/11/2023
https://www.pharmgkb.org/labelAnnotation/PA166317742		PA166317742	Annotation of EMA Label for margetuximab	EMA									margetuximab			
https://www.pharmgkb.org/labelAnnotation/PA166184524		PA166184524	"Annotation of FDA Label for alpelisib and ERBB2, ESR1, ESR2, PIK3CA"	FDA	On FDA Biomarker List	Testing Required					Cancer Genome		alpelisib	ERBB2; ESR1; ESR2; PIK3CA		8/31/2023
https://www.pharmgkb.org/labelAnnotation/PA166190261		PA166190261	"Annotation of FDA Label for estradiol / progesterone and PROC, PROS1, SERPINC1"	FDA	On FDA Biomarker List	Actionable PGx	Prescribing Info		Alternate Drug			Prescribing	estradiol / progesterone	PROC; PROS1; SERPINC1		
https://www.pharmgkb.org/labelAnnotation/PA166251561		PA166251561	Annotation of FDA Label for casimersen and DMD	FDA	On FDA Biomarker List	Testing Required							casimersen	DMD		8/21/2023
https://www.pharmgkb.org/labelAnnotation/PA166251621		PA166251621	Annotation of FDA Label for viloxazine and SLCO1B1	FDA	On FDA Biomarker List								viloxazine	SLCO1B1		8/29/2023
https://www.pharmgkb.org/labelAnnotation/PA166182721		PA166182721	"Annotation of FDA Label for erdafitinib and FGFR2, FGFR3"	FDA	On FDA Biomarker List	Testing Required					Cancer Genome		erdafitinib	FGFR2; FGFR3		8/31/2023
https://www.pharmgkb.org/labelAnnotation/PA166159964		PA166159964	"Annotation of FDA Label for olaparib and BRCA1, BRCA2, ERBB2"	FDA	On FDA Biomarker List	Testing Required					Cancer Genome		olaparib	BRCA1; BRCA2; ERBB2		9/1/2023
https://www.pharmgkb.org/labelAnnotation/PA166251522		PA166251522	Annotation of FDA Label for cabotegravir / rilpivirine and HLA-B	FDA	On FDA Biomarker List								cabotegravir / rilpivirine	HLA-B		12/5/2023
https://www.pharmgkb.org/labelAnnotation/PA166268882		PA166268882	"Annotation of FDA Label for belzutifan and CYP2C19, UGT2B17"	FDA	On FDA Biomarker List	Actionable PGx	Prescribing Info			Other Prescribing Guidance		Prescribing	belzutifan	CYP2C19; UGT2B17	CYP2C19*2; CYP2C19*3	9/28/2023
https://www.pharmgkb.org/labelAnnotation/PA166182722		PA166182722	Annotation of FDA Label for erdafitinib and CYP2C9	FDA	On FDA Biomarker List	Actionable PGx	Prescribing Info			Other Prescribing Guidance		Prescribing	erdafitinib	CYP2C9	CYP2C9*3	10/9/2019
https://www.pharmgkb.org/labelAnnotation/PA166316381		PA166316381	Annotation of FDA Label for gentamicin and MT-RNR1	FDA	On FDA Biomarker List	Actionable PGx	Prescribing Info		Alternate Drug			Prescribing	gentamicin	MT-RNR1	rs267606617	
https://www.pharmgkb.org/labelAnnotation/PA166316361		PA166316361	Annotation of FDA Label for streptomycin and MT-RNR1	FDA	On FDA Biomarker List	Actionable PGx	Prescribing Info		Alternate Drug			Prescribing	streptomycin	MT-RNR1	rs267606617	
https://www.pharmgkb.org/labelAnnotation/PA166317641		PA166317641	Annotation of EMA Label for mavacamten and CYP2C19	EMA		Testing Required	Prescribing Info	Dosing Info				Prescribing	mavacamten	CYP2C19	CYP2C19*1; CYP2C19*2; CYP2C19*3	7/24/2024
https://www.pharmgkb.org/labelAnnotation/PA166313401		PA166313401	Annotation of FDA Label for lecanemab and APOE	FDA	On FDA Biomarker List	Testing Required							lecanemab	APOE	rs429358; rs7412	8/16/2024
https://www.pharmgkb.org/labelAnnotation/PA166317521		PA166317521	"Annotation of EMA Label for asciminib and ABL1, BCR"	EMA		Testing Required					Cancer Genome		asciminib	ABL1; BCR		8/26/2024
https://www.pharmgkb.org/labelAnnotation/PA166251601		PA166251601	Annotation of FDA Label for viloxazine and CYP2D6	FDA	On FDA Biomarker List	Informative PGx							viloxazine	CYP2D6		
https://www.pharmgkb.org/labelAnnotation/PA166184754		PA166184754	Annotation of FDA Label for procainamide and NAT2	FDA	On FDA Biomarker List	Informative PGx							procainamide	NAT2		9/7/2023
https://www.pharmgkb.org/labelAnnotation/PA166235901		PA166235901	"Annotation of FDA Label for margetuximab and FCGR2A, FCGR2B, FCGR3A"	FDA	On FDA Biomarker List	No Clinical PGx							margetuximab	FCGR2A; FCGR2B; FCGR3A		
https://www.pharmgkb.org/labelAnnotation/PA166317442		PA166317442	"Annotation of EMA Label for Ascorbic acid (vitamin C), plain"	EMA									"Ascorbic acid (vitamin C), plain"			
https://www.pharmgkb.org/labelAnnotation/PA166317443		PA166317443	Annotation of EMA Label for desmopressin	EMA									desmopressin			
https://www.pharmgkb.org/labelAnnotation/PA166317444		PA166317444	Annotation of EMA Label for levothyroxine	EMA									levothyroxine			
https://www.pharmgkb.org/labelAnnotation/PA166317445		PA166317445	Annotation of EMA Label for olutasidenib	EMA									olutasidenib			
https://www.pharmgkb.org/labelAnnotation/PA166317461		PA166317461	Annotation of EMA Label for mirvetuximab soravtansine	EMA									mirvetuximab soravtansine			
https://www.pharmgkb.org/labelAnnotation/PA166317441		PA166317441	Annotation of EMA Label for adagrasib	EMA									adagrasib			
https://www.pharmgkb.org/labelAnnotation/PA166317481		PA166317481	Annotation of EMA Label for desflurane	EMA									desflurane			
https://www.pharmgkb.org/labelAnnotation/PA166317482		PA166317482	Annotation of EMA Label for isoflurane	EMA									isoflurane			
https://www.pharmgkb.org/labelAnnotation/PA166317483		PA166317483	Annotation of EMA Label for belzutifan	EMA									belzutifan			
https://www.pharmgkb.org/labelAnnotation/PA166317501		PA166317501	Annotation of EMA Label for sevoflurane	EMA									sevoflurane			
https://www.pharmgkb.org/labelAnnotation/PA166317502		PA166317502	Annotation of EMA Label for succinylcholine	EMA									succinylcholine			
https://www.pharmgkb.org/labelAnnotation/PA166317503		PA166317503	Annotation of EMA Label for escitalopram	EMA									escitalopram			
https://www.pharmgkb.org/labelAnnotation/PA166317504		PA166317504	Annotation of EMA Label for estradiol valerate	EMA									estradiol valerate			
https://www.pharmgkb.org/labelAnnotation/PA166317581		PA166317581	Annotation of EMA Label for capmatinib and MET	EMA		Testing Required					Cancer Genome		capmatinib	MET		
https://www.pharmgkb.org/labelAnnotation/PA166317741		PA166317741	Annotation of EMA Label for infigratinib	EMA									infigratinib			
https://www.pharmgkb.org/labelAnnotation/PA166317721		PA166317721	Annotation of EMA Label for casimersen	EMA									casimersen			
https://www.pharmgkb.org/labelAnnotation/PA166317701		PA166317701	Annotation of EMA Label for golodirsen	EMA									golodirsen			
https://www.pharmgkb.org/labelAnnotation/PA166317663		PA166317663	Annotation of EMA Label for fosphenytoin	EMA									fosphenytoin			
https://www.pharmgkb.org/labelAnnotation/PA166317662		PA166317662	Annotation of EMA Label for enflurane	EMA									enflurane			
https://www.pharmgkb.org/labelAnnotation/PA166317761		PA166317761	Annotation of EMA Label for metoclopramide	EMA									metoclopramide			
https://www.pharmgkb.org/labelAnnotation/PA166317762		PA166317762	Annotation of EMA Label for mivacurium	EMA									mivacurium			
https://www.pharmgkb.org/labelAnnotation/PA166317781		PA166317781	Annotation of EMA Label for mobocertinib	EMA									mobocertinib			
https://www.pharmgkb.org/labelAnnotation/PA166317782		PA166317782	Annotation of EMA Label for oliceridine	EMA									oliceridine			
https://www.pharmgkb.org/labelAnnotation/PA166317783		PA166317783	Annotation of EMA Label for oxymetazoline and tetracaine	EMA									oxymetazoline and tetracaine			
https://www.pharmgkb.org/labelAnnotation/PA166317681		PA166317681	Annotation of EMA Label for mitapivat and PKLR	EMA									mitapivat	PKLR	rs118204085	8/9/2024
https://www.pharmgkb.org/labelAnnotation/PA166317784		PA166317784	Annotation of EMA Label for phenytoin	EMA									phenytoin			
https://www.pharmgkb.org/labelAnnotation/PA166317801		PA166317801	Annotation of EMA Label for procainamide	EMA									procainamide			
https://www.pharmgkb.org/labelAnnotation/PA166317821		PA166317821	Annotation of EMA Label for tretinoin	EMA									tretinoin			
https://www.pharmgkb.org/labelAnnotation/PA166317841		PA166317841	Annotation of EMA Label for valproic acid	EMA									valproic acid			
https://www.pharmgkb.org/labelAnnotation/PA166317822		PA166317822	Annotation of EMA Label for viloxazine	EMA									viloxazine			
https://www.pharmgkb.org/labelAnnotation/PA166317842		PA166317842	Annotation of EMA Label for viltolarsen	EMA									viltolarsen			
https://www.pharmgkb.org/labelAnnotation/PA166317901		PA166317901	Annotation of HCSC Label for adagrasib	HCSC									adagrasib			
https://www.pharmgkb.org/labelAnnotation/PA166317902		PA166317902	"Annotation of HCSC Label for Ascorbic acid (vitamin C), plain"	HCSC									"Ascorbic acid (vitamin C), plain"			
https://www.pharmgkb.org/labelAnnotation/PA166317882		PA166317882	Annotation of HCSC Label for futibatinib	HCSC									futibatinib			
https://www.pharmgkb.org/labelAnnotation/PA166317903		PA166317903	Annotation of HCSC Label for mirvetuximab soravtansine	HCSC									mirvetuximab soravtansine			
https://www.pharmgkb.org/labelAnnotation/PA166317904		PA166317904	Annotation of HCSC Label for olutasidenib	HCSC									olutasidenib			
https://www.pharmgkb.org/labelAnnotation/PA166317905		PA166317905	Annotation of HCSC Label for pegloticase	HCSC									pegloticase			
https://www.pharmgkb.org/labelAnnotation/PA166317906		PA166317906	Annotation of HCSC Label for ganaxolone	HCSC									ganaxolone			
https://www.pharmgkb.org/labelAnnotation/PA166317883		PA166317883	Annotation of HCSC Label for mitapivat	HCSC									mitapivat			
https://www.pharmgkb.org/labelAnnotation/PA166317907		PA166317907	Annotation of HCSC Label for vutrisiran	HCSC									vutrisiran			
https://www.pharmgkb.org/labelAnnotation/PA166317884		PA166317884	Annotation of HCSC Label for casimersen	HCSC									casimersen			
https://www.pharmgkb.org/labelAnnotation/PA166317908		PA166317908	Annotation of HCSC Label for crizanlizumab-tmca	HCSC									crizanlizumab-tmca			
https://www.pharmgkb.org/labelAnnotation/PA166317941		PA166317941	Annotation of HCSC Label for lonafarnib	HCSC									lonafarnib			
https://www.pharmgkb.org/labelAnnotation/PA166317942		PA166317942	Annotation of HCSC Label for margetuximab	HCSC									margetuximab			
https://www.pharmgkb.org/labelAnnotation/PA166317961		PA166317961	Annotation of HCSC Label for mobocertinib	HCSC									mobocertinib			
https://www.pharmgkb.org/labelAnnotation/PA166317947		PA166317947	Annotation of HCSC Label for procainamide	HCSC									procainamide			
https://www.pharmgkb.org/labelAnnotation/PA166317962		PA166317962	Annotation of HCSC Label for ropeginterferon alfa-2b	HCSC									ropeginterferon alfa-2b			
https://www.pharmgkb.org/labelAnnotation/PA166317963		PA166317963	Annotation of HCSC Label for rucaparib	HCSC									rucaparib			
https://www.pharmgkb.org/labelAnnotation/PA166317949		PA166317949	Annotation of HCSC Label for viloxazine	HCSC									viloxazine			
https://www.pharmgkb.org/labelAnnotation/PA166317964		PA166317964	Annotation of HCSC Label for viltolarsen	HCSC									viltolarsen			
https://www.pharmgkb.org/labelAnnotation/PA166317950		PA166317950	Annotation of HCSC Label for voxelotor	HCSC									voxelotor			
https://www.pharmgkb.org/labelAnnotation/PA166318001		PA166318001	"Annotation of HCSC Label for setmelanotide and LEPR, PCSK1, POMC"	HCSC		Testing Required							setmelanotide	LEPR; PCSK1; POMC		
https://www.pharmgkb.org/labelAnnotation/PA166319021		PA166319021	"Annotation of FDA Label for mepolizumab and FIP1L1, PDGFRA"	FDA	On FDA Biomarker List								mepolizumab	FIP1L1; PDGFRA		
https://www.pharmgkb.org/labelAnnotation/PA166294083		PA166294083	Annotation of HCSC Label for durvalumab and CD274	HCSC							Cancer Genome		durvalumab	CD274		8/15/2023
https://www.pharmgkb.org/labelAnnotation/PA166317221		PA166317221	"Annotation of FDA Label for rozanolixizumab and CHRNA1, CHRNA3, CHRNA4, CHRNA5, CHRNA6, CHRNA7, CHRNB1, CHRNE, MUSK"	FDA	On FDA Biomarker List								rozanolixizumab	CHRNA1; CHRNA3; CHRNA4; CHRNA5; CHRNA6; CHRNA7; CHRNB1; CHRNE; MUSK		
https://www.pharmgkb.org/labelAnnotation/PA166317281		PA166317281	"Annotation of FDA Label for leniolisib and PIK3CD, PIK3R1"	FDA	On FDA Biomarker List								leniolisib	PIK3CD; PIK3R1		
https://www.pharmgkb.org/labelAnnotation/PA166319001		PA166319001	"Annotation of FDA Label for sacituzumab govitecan and BRCA1, BRCA2"	FDA	On FDA Biomarker List								sacituzumab govitecan	BRCA1; BRCA2		
https://www.pharmgkb.org/labelAnnotation/PA166319101		PA166319101	Annotation of FDA Label for tofersen and SOD1	FDA	On FDA Biomarker List								tofersen	SOD1		8/6/2024
https://www.pharmgkb.org/labelAnnotation/PA166317881		PA166317881	"Annotation of EMA Label for lonafarnib and LMNA, ZMPSTE24"	EMA		Testing Required							lonafarnib	LMNA; ZMPSTE24		11/21/2023
https://www.pharmgkb.org/labelAnnotation/PA166293282		PA166293282	"Annotation of FDA Label for Ascorbic acid (vitamin C), combinations, Ascorbic acid (vitamin C), plain, sodium ascorbate and G6PD"	FDA	On FDA Biomarker List	Actionable PGx	Prescribing Info	Dosing Info		Other Prescribing Guidance		Prescribing	"Ascorbic acid (vitamin C), combinations; Ascorbic acid (vitamin C), plain; sodium ascorbate"	G6PD		5/23/2023
https://www.pharmgkb.org/labelAnnotation/PA166317948		PA166317948	Annotation of HCSC Label for rimegepant and CYP2C9	HCSC		No Clinical PGx							rimegepant	CYP2C9	CYP2C9*2; CYP2C9*3	3/13/2024
https://www.pharmgkb.org/labelAnnotation/PA166317943		PA166317943	"Annotation of HCSC Label for metreleptin and AGPAT2, BSCL2, LEP, LMNB2"	HCSC		Testing Required							metreleptin	AGPAT2; BSCL2; LEP; LMNB2		8/9/2024
https://www.pharmgkb.org/labelAnnotation/PA166318021		PA166318021	Annotation of HCSC Label for tremelimumab	HCSC									tremelimumab			
https://www.pharmgkb.org/labelAnnotation/PA166317981		PA166317981	Annotation of HCSC Label for mavacamten and CYP2C19	HCSC		Informative PGx							mavacamten	CYP2C19		12/20/2023
https://www.pharmgkb.org/labelAnnotation/PA166318981		PA166318981	"Annotation of FDA Label for sacituzumab govitecan and ERBB2, ESR1, ESR2"	FDA	On FDA Biomarker List	Testing Required					Cancer Genome		sacituzumab govitecan	ERBB2; ESR1; ESR2		
https://www.pharmgkb.org/labelAnnotation/PA166284042		PA166284042	"Annotation of EMA Label for entrectinib and NTRK1, NTRK2, NTRK3, ROS1"	EMA		Testing Required					Cancer Genome		entrectinib	NTRK1; NTRK2; NTRK3; ROS1		4/16/2024
https://www.pharmgkb.org/labelAnnotation/PA166283922		PA166283922	Annotation of EMA Label for gemtuzumab ozogamicin and CD33	EMA		Testing Required					Cancer Genome		gemtuzumab ozogamicin	CD33		4/16/2024
https://www.pharmgkb.org/labelAnnotation/PA166294381		PA166294381	Annotation of EMA Label for evolocumab	EMA									evolocumab			8/14/2024
https://www.pharmgkb.org/labelAnnotation/PA166184454		PA166184454	Annotation of Swissmedic Label for galantamine and CYP2D6	Swissmedic		Informative PGx							galantamine	CYP2D6		11/13/2023
https://www.pharmgkb.org/labelAnnotation/PA166283781		PA166283781	"Annotation of EMA Label for givosiran and CPOX, HMBS, PPOX"	EMA									givosiran	CPOX; HMBS; PPOX		11/20/2023
https://www.pharmgkb.org/labelAnnotation/PA166122907		PA166122907	Annotation of EMA Label for vandetanib and RET	EMA		Testing Required							vandetanib	RET		12/5/2023
https://www.pharmgkb.org/labelAnnotation/PA166121250		PA166121250	"Annotation of EMA Label for lomitapide and APOB, LDLR, PCSK9"	EMA		Testing Required							lomitapide	APOB; LDLR; PCSK9		8/8/2024
https://www.pharmgkb.org/labelAnnotation/PA166121252		PA166121252	Annotation of EMA Label for ofatumumab and MS4A1	EMA							Cancer Genome		ofatumumab	MS4A1		8/17/2023
https://www.pharmgkb.org/labelAnnotation/PA166122968		PA166122968	Annotation of EMA Label for sildenafil	EMA									sildenafil			8/24/2023
https://www.pharmgkb.org/labelAnnotation/PA166123388		PA166123388	Annotation of EMA Label for ruxolitinib and CYP3A4	EMA									ruxolitinib	CYP3A4		8/24/2023
https://www.pharmgkb.org/labelAnnotation/PA166123411		PA166123411	Annotation of EMA Label for sirolimus and CYP3A4	EMA									sirolimus	CYP3A4		8/24/2023
https://www.pharmgkb.org/labelAnnotation/PA166123413		PA166123413	Annotation of EMA Label for zonisamide and CYP3A4	EMA									zonisamide	CYP3A4		8/29/2023
https://www.pharmgkb.org/labelAnnotation/PA166123417		PA166123417	Annotation of EMA Label for telithromycin and CYP3A4	EMA									telithromycin	CYP3A4		8/24/2023
https://www.pharmgkb.org/labelAnnotation/PA166123420		PA166123420	Annotation of EMA Label for fosamprenavir and CYP3A4	EMA									fosamprenavir	CYP3A4		8/17/2023
https://www.pharmgkb.org/labelAnnotation/PA166123424		PA166123424	Annotation of EMA Label for darunavir and CYP3A4	EMA									darunavir	CYP3A4		8/15/2023
https://www.pharmgkb.org/labelAnnotation/PA166317885		PA166317885	Annotation of HCSC Label for fosdenopterin	HCSC									fosdenopterin			
https://www.pharmgkb.org/labelAnnotation/PA166317945		PA166317945	Annotation of HCSC Label for oliceridine	HCSC									oliceridine			
https://www.pharmgkb.org/labelAnnotation/PA166317921		PA166317921	Annotation of HCSC Label for golodirsen	HCSC									golodirsen			
https://www.pharmgkb.org/labelAnnotation/PA166317946		PA166317946	Annotation of HCSC Label for oxymetazoline and tetracaine	HCSC									oxymetazoline and tetracaine			
https://www.pharmgkb.org/labelAnnotation/PA166104882		PA166104882	Annotation of EMA Label for desloratadine	EMA									desloratadine			9/6/2023
https://www.pharmgkb.org/labelAnnotation/PA166105315		PA166105315	Annotation of EMA Label for nelfinavir and CYP3A4	EMA									nelfinavir	CYP3A4		8/15/2023
https://www.pharmgkb.org/labelAnnotation/PA166123529		PA166123529	Annotation of PMDA Label for atorvastatin and LDLR	PMDA									atorvastatin	LDLR		9/25/2023
https://www.pharmgkb.org/labelAnnotation/PA166123545		PA166123545	Annotation of PMDA Label for lenalidomide	PMDA							Cancer Genome		lenalidomide			9/26/2023
https://www.pharmgkb.org/labelAnnotation/PA166123549		PA166123549	Annotation of PMDA Label for tolterodine and CYP2D6	PMDA		Informative PGx							tolterodine	CYP2D6		8/14/2023
https://www.pharmgkb.org/labelAnnotation/PA166123553		PA166123553	Annotation of PMDA Label for abacavir and HLA-B	PMDA		Informative PGx							abacavir	HLA-B		8/14/2023
https://www.pharmgkb.org/labelAnnotation/PA166120286		PA166120286	Annotation of EMA Label for esomeprazole and CYP2C19	EMA		No Clinical PGx							esomeprazole	CYP2C19		8/17/2023
https://www.pharmgkb.org/labelAnnotation/PA166317944		PA166317944	Annotation of HCSC Label for odevixibat and ABCB11	HCSC									odevixibat	ABCB11		8/16/2024
https://www.pharmgkb.org/labelAnnotation/PA166127640		PA166127640	Annotation of HCSC Label for boceprevir and IFNL3	HCSC		No Clinical PGx							boceprevir	IFNL3		7/26/2024
https://www.pharmgkb.org/labelAnnotation/PA166119827		PA166119827	Annotation of EMA Label for dextromethorphan / quinidine and CYP2D6	EMA		No Clinical PGx							dextromethorphan / quinidine	CYP2D6		8/28/2023
https://www.pharmgkb.org/labelAnnotation/PA166123414		PA166123414	"Annotation of EMA Label for dronedarone and CYP2D6, CYP3A4"	EMA		No Clinical PGx							dronedarone	CYP2D6; CYP3A4		8/15/2023
https://www.pharmgkb.org/labelAnnotation/PA166123387		PA166123387	"Annotation of EMA Label for axitinib and CYP2C19, UGT1A1"	EMA		No Clinical PGx							axitinib	CYP2C19; UGT1A1		8/14/2023
https://www.pharmgkb.org/labelAnnotation/PA166127691		PA166127691	Annotation of HCSC Label for metoprolol and CYP2D6	HCSC		Informative PGx							metoprolol	CYP2D6		7/25/2024
https://www.pharmgkb.org/labelAnnotation/PA166127713		PA166127713	"Annotation of HCSC Label for succinylcholine and BCHE, CACNA1S, RYR1"	HCSC		Actionable PGx	Prescribing Info		Alternate Drug			Prescribing	succinylcholine	BCHE; CACNA1S; RYR1		4/1/2023
https://www.pharmgkb.org/labelAnnotation/PA166160720		PA166160720	Annotation of PMDA Label for omeprazole and CYP2C19	PMDA		Informative PGx							omeprazole	CYP2C19		8/14/2023
https://www.pharmgkb.org/labelAnnotation/PA166161087		PA166161087	Annotation of PMDA Label for isoniazid and NAT2	PMDA		Informative PGx							isoniazid	NAT2		8/14/2023
https://www.pharmgkb.org/labelAnnotation/PA166183789		PA166183789	Annotation of Swissmedic Label for metabutethamine and G6PD	Swissmedic		Actionable PGx	Prescribing Info					Prescribing	metabutethamine	G6PD		2/28/2023
https://www.pharmgkb.org/labelAnnotation/PA166184129		PA166184129	Annotation of Swissmedic Label for daclatasvir and IFNL3	Swissmedic		Informative PGx							daclatasvir	IFNL3		8/15/2023
https://www.pharmgkb.org/labelAnnotation/PA166184380		PA166184380	"Annotation of Swissmedic Label for brivaracetam and CYP2C19, CYP2C9"	Swissmedic		Informative PGx							brivaracetam	CYP2C19; CYP2C9		
https://www.pharmgkb.org/labelAnnotation/PA166272161		PA166272161	"Annotation of EMA Label for venetoclax and FLT3, IDH1, IDH2, NPM1, TP53"	EMA							Cancer Genome		venetoclax	FLT3; IDH1; IDH2; NPM1; TP53		8/29/2023
https://www.pharmgkb.org/labelAnnotation/PA166272181		PA166272181	Annotation of EMA Label for upadacitinib and CYP2D6	EMA									upadacitinib	CYP2D6		8/29/2023
https://www.pharmgkb.org/labelAnnotation/PA166272261		PA166272261	"Annotation of HCSC Label for venetoclax and FLT3, IDH1, IDH2, NPM1, TP53"	HCSC							Cancer Genome		venetoclax	FLT3; IDH1; IDH2; NPM1; TP53		8/29/2023
https://www.pharmgkb.org/labelAnnotation/PA166272621		PA166272621	Annotation of EMA Label for tafamidis and TTR	EMA									tafamidis	TTR		8/24/2023
